"Hauptstraße, auf dem Friedhof",Bann (Pfalz),"Friedhofskreuz, spätbarock, bezeichnet 1776; Kriegerdenkmal 1914/18, eingeweiht am 30. Juni 1929, Soldat, nach dem Zweiten Weltkrieg erweitert",50.468717,8.651603
Hauptstraße 76,Bann (Pfalz),"ehemaliges Sickingensches Forsthaus; eineinhalbgeschossiger Rokokobau, 1761",49.604882,6.770629
Kirchenstraße,Bann (Pfalz),"Katholische Pfarrkirche St. Valentin; neugotische Basilika, Rotsandsteinquaderbau, 1881/82, Architekt Franz Schöberl, Speyer",49.388416,7.610635
1 km südlich des Ortes,Bann (Pfalz),"Katholische Kapelle St. Barbara; kleiner neuromanischer Sandsteinquaderbau, Einweihung am 14. Oktober 1900","",""
"an der L 363, nördlich des Ortes",Bann (Pfalz),Menhir; jungsteinzeitlich; nachträglich eingeritztes Kreuz,53.975883,10.588352
auf dem ‚Kleinen Berg‘ in der Nähe der ‚Römischen Höhensiedlung Großer Berg‘,Bann (Pfalz),"Burg Perlenberg; stauferzeitliche Ruine; wohl im ersten Drittel des 13. Jahrhunderts begonnen und nicht vollendet, 1542 erwähnt und bereits verfallen; erhalten: Stumpf eines Bergfrieds",50.853123,7.087303
Hauptstraße/Ecke Am Goldbuckel,Bann (Pfalz),"Wegekreuz, auch bekannt als Missionskreuz; Sandstein, angeblich bezeichnet 1852 (?), wohl eher um 1800. Laut Chronik der Gemeinde Bann wurde das Missionskreuz anlässlich der Volksmission in Landstuhl, zu der auch die umliegenden Orte incl. Bann miteinbezogen waren, zwischen dem 20. Mai 1768 und dem 13. Juni 1768 errichtet.",51.229774,10.679073
im Wald nördlich des Ortes,Bann (Pfalz),"Forsthaus Steigerhof; kleine Hofanlage; eingeschossiges klassizistisches Wohnhaus, Mitte des 19. Jahrhunderts","",""
Friedhofstraße 1,Bruchmühlbach,"Katholische Pfarrkirche St. Maria Magdalena; neuromanischer Saalbau, 1863/64, Architekt Ludwig Hagemann, Speyer, erweitert 1932, 1947 und 1959 von Tameran, Seeberger, Stempfle und Wingert",49.390369,7.465323
Kaiserstraße 19,Bruchmühlbach,"ehemaliges katholisches Pfarrhaus (?), spätklassizistischer Krüppelwalmdachbau, um 1860",49.38946,7.439838
Kaiserstraße 21,Bruchmühlbach,"Hofanlage, drittes Viertel des 19. Jahrhunderts; spätklassizistische Einfirstanlage mit Torbogen, Ladeneinbau des 19. Jahrhunderts",49.38946,7.439838
Kaiserstraße 47,Bruchmühlbach,"Hofanlage, Ende des 18. oder 19. Jahrhundert; spätbarockes Wohnhaus, teilweise Fachwerk, bezeichnet 1792; Hofflügel wohl gleichzeitig, Wirtschaftsgebäude, gründerzeitlicher Fabrik-Schornstein",49.38946,7.439838
Kaiserstraße 54,Bruchmühlbach,"Wohnhaus (ehemalige Schule?); stattlicher gründerzeitlicher Putzbau mit Mittelrisalit, zweite Hälfte des 19. Jahrhunderts",49.38946,7.439838
Kaiserstraße 76,Bruchmühlbach,"Hofanlage; spätklassizistisches Wohnhaus, um das dritte Viertel des 19. Jahrhunderts; dahinter mehrteilige Baugruppe mit dreigeschossigem Lagerhaus, wohl aus der ersten Hälfte des 19. Jahrhunderts",49.38946,7.439838
Tausendmühle,Bruchmühlbach,"spätklassizistisches Hauptgebäude mit Kniestock, wohl um 1870/80",49.379126,7.457203
Schanzerstraße 2,Elschbach,"Einfirstanlage, teilweise Fachwerk, wohl aus der ersten Hälfte des 19. Jahrhunderts",49.416596,7.433325
Bahnhofstraße 3,Miesau,"ehemalige (?) Schmiede; kleiner Putzbau mit Torbogen, 19. Jahrhundert",49.38946,7.439838
Bahnhofstraße 4,Miesau,"stattliche Hofanlage, Ende des 19. Jahrhunderts; Walmdachbau mit Mittelrisalit, Neurenaissance, Großscheune",49.38946,7.439838
"Elschbacher Straße, auf dem Friedhof",Miesau,"Grabstätte Familie Dr. Pracht, Granitstele mit lebensgroßem Galvanorelief, 1902, Bildhauer Menges, Kaiserslautern; Grabmal Karl Weber, spätklassizistische Stele, Mitte des 19. Jahrhunderts",49.408103,7.435697
Hütschenhauser Straße 4,Miesau,"Hofanlage, Vierseithof, 19. Jahrhundert; spätklassizistisches Wohnhaus mit Kniestock, um 1870, Altenteil bezeichnet 1838",49.405137,7.43859
Hütschenhauser Straße 11,Miesau,"Hofanlage, Ende des 18. oder 19. Jahrhundert; spätbarocker Krüppelwalmdachbau, bezeichnet 1780, Nebengebäude",49.405225,7.438419
St. Wendeler Straße 18,Miesau,"ehemalige Schule; langgestreckter klassizistischer Putzbau, um 1830, wenig später erweitert",59.27986,11.123596
St. Wendeler Straße 24,Miesau,"Protestantische Kirche; barocker Saalbau, 1738",59.286548,11.116535
St. Wendeler Straße 25/27,Miesau,"Doppelwohnhaus; eineinhalbgeschossiger spätgründerzeitlicher Klinkerbau, um 1900",7.115207,-73.139752
St. Wendeler Straße 26,Miesau,"Protestantisches Pfarrhaus; Walmdachbau, Heimatstil, 1929",59.279887,11.122284
"St. Wendeler Straße, Ecke Elschbacher Straße",Miesau,"Kriegerdenkmal 1914/18, um 1930, nackter Krieger",7.115207,-73.139752
an der L 356,Miesau,"Schanzenmühle; Vierseitanlage, 19. Jahrhundert; spätklassizistisches Hauptgebäude mit Mezzanin und Mühlenteil; Scheune; gründerzeitliches Gartenhaus mit originalen Glasfenstern, gegen 1900",53.975883,10.588352
an der L 356 am westlichen Ortsausgang,Miesau,"Wasserbehälter; Fassade mit Segmentgiebel, bezeichnet 1912",53.975883,10.588352
Dorfstraße 13,Vogelbach,"Simultankirche St. Philippus und Jakobus; romanischer Saalbau nach Art der Wormser Schule, um 1200, um 1500, 1751 (bezeichnet) und 1821 verändert, achteckiger spätgotischer Turm",49.37932,7.427522
Vogelbachermühle 1 (nordwestlich des Ortes),Vogelbach,"Vogelbachermühle; langgestrecktes Hauptgebäude, teilweise Fachwerk, wohl aus der ersten Hälfte des 19. Jahrhunderts",,
Alsenzstraße 1,Alsenborn,"sogenanntes Orthsches Haus; spätbarockes Herrenhaus; Mansarddachbau, bezeichnet 1600, klassizistisches Portal",49.492697,7.919332
"Burgstraße, auf dem Friedhof",Alsenborn,"Kriegergedächtniskapelle 1914/18, neuklassizistische Rotunde, bezeichnet 1921; Kriegerdenkmal 1849, 1866 und 1870/71, Löwe, Sandstein, Porträt-Relief des Prinzregenten Luitpold, Bronze, um 1900",48.074934,8.643239
Rosenhofstraße 56,Alsenborn,"Walmdach-Villa, Turmrisalit, 1920er Jahre",49.490315,7.909495
Rosenhofstraße 73,Alsenborn,"sogenanntes Kutschenhaus Ritter; zweiflügeliger späthistoristischer Krüppelwalmdachbau, tleilweise Fachwerk, Remise, um 1900/10",49.490789,7.916844
Rosenhofstraße 95,Alsenborn,"Protestantische Pfarrkirche; ehemals St. Vitus, barocker Saalbau, 1733, Chorturm aus der Mitte des 13. Jahrhunderts, 1686 aufgestockt, Schieferhaube wohl 1733",49.491158,7.920742
Rosenhofstraße 104,Alsenborn,"ehemalige Schule; langgestreckter zweiteiliger Walmdachbau, 1823/24",49.490707,7.919628
Rosenhofstraße 106,Alsenborn,"große Hofanlage; spätbarocker Krüppelwalmdachbau, bezeichnet 1798",49.490678,7.920428
Rosenhofstraße 108,Alsenborn,"sogenanntes Haus Althoff; eingeschossiger barocker Mansardwalmdachbau über Hochkeller, bezeichnet 1728",49.490508,7.9205
"





Alsenzstraße 1",Enkenbach,"sogenanntes Orthsches Haus


",49.492697,7.919332
"





Burgstraße",Enkenbach,"Friedhof; Kriegergedächtniskapelle 1914/18


",49.491041,7.925566
"





Burgstraße",Enkenbach,"Friedhof; Kriegerdenkmal 1849, 1866 und 1870/71


",49.491041,7.925566
"





Rosenhofstraße",Enkenbach,"Protestantische Pfarrkirche


",49.489759,7.910412
"





Rosenhofstraße 104",Enkenbach,"ehemalige Schule


",49.490707,7.919628
"





Rosenhofstraße 108",Enkenbach,"sogenanntes Haus Althoff


",49.490508,7.9205
Denkmalzone Daubenbornerhof (Daubenbornerhof 1–5),Enkenbach,"gut erhaltene Hofanlagen vom 18. bis zum Anfang des 20. Jahrhunderts, die Wirtschaftsgebäude oft aus unverputztem Rotsandstein; gepflasterte Hofräume; Friedhof, zweite Hälfte des 19. Jahrhunderts",49.485756,7.897835
Kirchenstraße 15,Enkenbach,"Protestantische Kirche; spätklassizistischer Saalbau, 1832/33, neuromanischer Frontturm, fortgeschrittenes 19. Jahrhundert",49.488407,7.897045
Klosterstraße 9,Enkenbach,"Hofanlage; spätbarockes Fachwerkwohnhaus, bezeichnet 1774, Scheune, bezeichnet 1855",49.486137,7.898356
Klosterstraße 10,Enkenbach,"Katholische Pfarrkirche St. Norbert; ehemalige Klosterkirche St. Maria, spätromanische Gewölbebasilika, nach Abbruch von Klostergebäuden und südlichem Kreuzarm 1707/08 mit Turm über Vorhalle wiederhergestellt, 1876/77 südlicher Kreuzarm und Chor in romanischen Formen aufgebaut",49.486195,7.899156
"Ludwigshohl, Ecke Neuhohl",Enkenbach,"Ziehbrunnen, wohl vor 1835",49.485663,7.896048
Sembacher Straße,Enkenbach,"Kriegerdenkmal 1870/71; Obelisk aus Rotsandstein, letztes Viertel des 19. Jahrhunderts",49.49296,7.890631
"Sembacher Straße, auf dem Friedhof",Enkenbach,"Grabmal M. Krehbiehl, spätklassizistische Stele, 1839; Grabmal Familie Gebrüder Riess, Jugendstil-Schauwand, Sandstein, Inschrifttafeln Granit, um 1905/10; Grabmal D. F. Müller, gründerzeitliche Rotsandsteinstele, um 1900",49.49296,7.890631
an der B 48 nördlich des Ortes,Enkenbach,"ehemaliges protestantisches Kindererholungsheim; herrenhausartiger neubarocker Mansardwalmdachbau, Turmrisalit, bezeichnet 1906",54.137362,10.495574
an der B 48 nördlich des Ortes,Enkenbach,"Hahnerhof; Vierseithof, im Wesentlichen aus der Mitte des 19. Jahrhunderts; Wohnhaus und Scheune einfirstartig, langgestreckte Stallung",54.137362,10.495574
an der B 48 nördlich des Ortes,Enkenbach,"Obere Eselsmühle; Hofanlage; Mühle und Wohnhaus unter einem (Walm-)Dach, im Kern vielleicht aus dem 18. Jahrhundert, heutiges Erscheinungsbild vor allem aus dem 19. Jahrhundert",54.137362,10.495574
Daubenbornerhof 5,Enkenbach,"Hofanlage, Vierseithof; spätbarockes Einfirsthaus, teilweise Fachwerk, bezeichnet 1781 und 1868",49.465526,7.864104
"





Kirchenstraße",Enkenbach,"Protestantische Kirche


",49.487857,7.897018
"





Klosterstraße 9",Enkenbach,"Hofanlage


",49.486137,7.898356
"





Klosterstraße 10",Enkenbach,"Katholische Pfarrkirche St. Norbert


",49.486195,7.899156
"





Ludwigshohl/Ecke Neuhohl",Enkenbach,"Ziehbrunnen


",49.485663,7.896048
Schulstraße 3,Erzenhausen,"Einfirstanlage mit Torbogen, bezeichnet 1807, im Kern wohl älter",49.498747,7.619295
Schulstraße 7,Erzenhausen,"ehemalige Schule; spätklassizistischer Putzbau, um 1830/40",49.498998,7.618747
"Friedhofstraße, auf dem Friedhof",Grabmal Familie Schweizer,Fischbach (bei Kaiserslautern),"neugotische Stele, Sandstein, um 1900",49.454819,7.913847
Harztalerhof 3,Dreiseithof,Fischbach (bei Kaiserslautern),"Anfang des 19. Jahrhunderts; eingeschossiger Krüppelwalmdachbau, teilweise Fachwerk",49.46005,7.89936
(an) Hauptstraße 1,Spolie,Fischbach (bei Kaiserslautern),gotischer Gewölbeschlussstein,49.45408,7.91388
(bei) Hauptstraße 1,Grabstein Blick von Lichtenberg,Fischbach (bei Kaiserslautern),"Sandstein, um 1510",49.45408,7.91388
"Hintergasse 10, 12",zwei Backöfen,Fischbach (bei Kaiserslautern),"Bruchstein, 19. Jahrhundert",49.454638,7.915118
Bergstraße 1,Frankelbach,"Hofanlage, spätbarockes Fachwerkhaus, bezeichnet 1797",49.534108,7.634332
Stielweid 2,Frankelbach,"L-förmige Hofanlage mit Unterstallhaus, erste Hälfte des 19. Jahrhunderts",49.534126,7.634925
Am Bahnhof 1,Frankelbach,"Bahnhof Olsbrücken; letztes Viertel des 19. Jahrhunderts; eineinhalbgeschossiger gründerzeitlicher Sandsteinquaderbau, Nebengebäude",49.537657,7.653988
Denkmalzone Alter Friedhof (Friedhofstraße),Frankenstein (Pfalz),"reich verzierte Stele, um 1861; barocker Doppel-Grabstein, um 1750; Kreuzigungsgruppe mit Stifterfamilie, um 1760 sowie zwei weitere, um 1787 und um 1758; Kriegerdenkmal 1914/18, Sandstein, 1920er Jahre; klassizistischer Obelisk, nach 1772",49.438487,7.978082
Am Friedhof 1,Frankenstein (Pfalz),"Protestantische Kirche; neugotischer Saalbau, 1871/72, Bauinspektor Tanera und Bezirksbaumeister Julius Huth, Kaiserslautern; Ensemble mit Burgruine und Tunnelportal der Bahnlinie Ludwigshafen am Rhein–Saarbrücken",49.438469,7.976276
Hauptstraße 9,Frankenstein (Pfalz),"Bahnhof; zweieinhalbgeschossiger spätklassizistischer Walmdachbau mit Giebelrisalit, wohl drittes Viertel des 19. Jahrhunderts",49.439055,7.969853
Hauptstraße 19,Frankenstein (Pfalz),"Katholische Kirche Heilige Dreifaltigkeit und St. Ludwig; Saalbau, barockisierender Heimatstil, 1932/33, Architekt Paul Klostermann",49.439167,7.971785
Hauptstraße 22,Frankenstein (Pfalz),"eingeschossiges Unterstallhaus, Mitte des 19. Jahrhunderts",49.43912,7.972162
Hauptstraße 54,Frankenstein (Pfalz),"ehemalige Schule; Krüppelwalmdachbau, Heimatstil, Portalvorhalle, Jugendstil",49.440256,7.975126
Hauptstraße 98,Frankenstein (Pfalz),"Wohnhaus, stattlicher spätklassizistischer Krüppelwalmdachbau, um 1850, Anbau des 19. Jahrhunderts",49.438739,7.977633
oberhalb des Ortes,Frankenstein (Pfalz),"Burgruine Frankenstein; von der Anfang des 13. Jahrhunderts errichteten Anlage erhalten: Reste der Ringmauer und des Bergfried (Oberburg), des Wohnhauses, des ehemaligen Saals und der Kapelle (Unterburg); Zwinger und Flankenturm, wohl 15. Jahrhundert",49.438487,7.978082
nächst der B 37,Frankenstein (Pfalz),Tunnelportal; drittes Viertel des 19. Jahrhunderts,48.301866,15.066562
unterhalb der Burgruine,Frankenstein (Pfalz),"Tunnelportal der 1848 eröffneten Bahnlinie Ludwigshafen am Rhein–Saarbrücken; abgestufter Zinnengiebel, Rotsandsteinquader",49.438487,7.978082
Diemerstein,Frankenstein (Pfalz),"Brunnen, 19. Jahrhundert",49.4439,7.961373
Diemerstein,Frankenstein (Pfalz),"Brunnenstube, 19. Jahrhundert",49.4439,7.961373
Diemerstein 2,Frankenstein (Pfalz),"ehemalige Posthalterei; spätbarocker Massivbau, bezeichnet 1763, Baumeister Schmeisser; langgestreckter Rotsandsteinquader-Anbau, 19. Jahrhundert",49.438487,7.978082
Diemerstein 9,Frankenstein (Pfalz),"Villa Denis; sogenanntes Schlösschen, klassizistische Baugruppe mit Belvedereturm, 1847",49.438487,7.978082
"2 km oberhalb Frankenstein, kurz vor Mündung des Glasbachs in den Hochspeyerbach",Frankenstein (Pfalz),"Burgruine Diemerstein; Ringmauerreste der Unterburg; Bergfried, 13. Jahrhundert; Reste eines Wohnhauses, 16. Jahrhundert; 1847 Wiederherstellung von Ringmauer, Treppenanlagen, Felsgang",48.785201,132.904039
Denkmalzone Friedhof (Adam-Müller-Straße),Gerhardsbrunn,"Inschriftstele, um 1829; Rotsandstein-Obelisk auf Unterbau, um 1839; Marmorgrabmal, um 1879; Rotsandstein-Obelisk, um 1830; Stele mit Urnenaufsatz, 1830",49.355895,7.521594
Adam-Müller-Straße 2/4,Gerhardsbrunn,"Protestantische Kirche; klassizistischer Kombinationsbau (mit ehemaligem Schulhaus), bezeichnet 1825, nach Kriegszerstörung 1954 auf den alten Grundmauern wieder errichtet",49.356235,7.519312
Adam-Müller-Straße 14,Gerhardsbrunn,"Dreiseithof; barockes Fachwerkhaus, teilweise verschiefert, wohl 1733, Scheunen, bezeichnet 1859 und 1869",49.355337,7.521064
Adam-Müller-Straße 22,Gerhardsbrunn,"Hofanlage; Wohnhaus, teilweise Fachwerk, im Kern vielleicht noch aus dem 18. Jahrhundert, vor der Mitte des 19. Jahrhunderts überformt; Scheune, zweite Hälfte des 19. Jahrhunderts; Hofpflaster",49.354656,7.518944
Adam-Müller-Straße 27,Gerhardsbrunn,"Hofanlage, Dreiseithof, im Kern vom Anfang des 19. Jahrhunderts",49.356188,7.521432
an der K 67 südöstlich des Ortes,Gerhardsbrunn,"sogenannte Scharrmühle; Vierseitanlage; Krüppelwalmdachbau, bezeichnet 1862",49.160943,11.261586
Hauptstraße 10/12,Heiligenmoschel,"Wohnhaus, barockes Fachwerkhaus, teilweise massiv, bezeichnet 1703",49.555648,7.757536
Im Pfarrhof 2,Heiligenmoschel,"ehemaliger protestantischer Pfarrhof; spätbarocker Krüppelwalmdachbau, zweite Hälfte des 18. Jahrhunderts",49.555817,7.75989
Kirchgasse 33,Heiligenmoschel,"Protestantische Pfarrkirche; barocker Saalbau, bezeichnet 1748/49, Architekt Sigmund Jakob Haeckher; gotischer Ostturm, um 1300, Glockengeschoss barock; Kriegerdenkmal 1914/18, 1920er Jahre, Soldat",49.557769,7.760312
Gemarkungsdreieck mit Otterberg und Höringen,Heiligenmoschel,"Grenzstein, 13. Jahrhundert",49.5567,7.758731
Gemarkungsdreieck mit Otterberg und Höringen,Heiligenmoschel,"Menhir; Sandstein, jungsteinzeitlich",49.5567,7.758731
Denkmalzone Friedhof (Friedhofstraße),Hochspeyer,"Gruppe von fünf barocken Grabsteinen des 18. Jahrhunderts, mit Reliefs und Inschriften; Grabmal Familie Jakob Ruby, neuklassizistische Granitstele, Relief einer Trauernden, um 1911; Grabmal Familie Barth, Schauwand, Neurenaissance, um 1886; Grabmal A. M. Rubeler, klassizistische Rotsandstein-Stele mit Urnenbekrönung, um 1832; Grabstätte Familie Diemer, kleine Anlage mit Grabsteinen des 19. und vom Anfang des 20. Jahrhunderts; Kriegerdenkmal 1914/18, 1920er Jahre; Grabstätte Familie Ritter, kleine Anlage mit drei spätklassizistischen Grabsteinen; Kriegerdenkmal 1870/71, letztes Viertel des 19. Jahrhunderts",49.443396,7.892293
Denkmalzone Jüdischer Friedhof,Hochspeyer,"1927 eröffnet, sieben Granitgrabsteine von 1927 bis 1936",49.443396,7.892293
Fischbacher Straße 8,Hochspeyer,"Fachwerk-Wohnhaus, barockes Fachwerkhaus, teilweise massiv, 18. Jahrhundert",49.444579,7.898284
Hauptstraße 58,Hochspeyer,"Katholische Pfarrkirche St. Laurentius; neugotischer Saalbau, 1859, Baurat Tanera, Speyer, 1912 von Rudolf von Perignon erweitert",49.440918,7.87209
Hauptstraße 97,Hochspeyer,"Forstamt; villenartiger gründerzeitlicher Sandsteinquaderbau, Ende des 19. Jahrhunderts",49.440918,7.87209
Hauptstraße 102,Hochspeyer,"Wohnhaus, klassizistischer Krüppelwalmdachbau, um 1800",49.440918,7.87209
Hauptstraße 107,Hochspeyer,"Fachwerk-Wohnhaus, barockes Fachwerkhaus, 18. Jahrhundert, Erdgeschoss im 19. Jahrhundert verändert, eingeschossiger Fachwerkanbau",49.440918,7.87209
Hauptstraße 121,Hochspeyer,"Rathaus; neubarocker Mansarddachbau mit Krüppelwalmen, bezeichnet 1909",49.440918,7.87209
Hauptstraße 122,Hochspeyer,"Hofanlage, Dreiseithof; klassizistischer Krüppelwalmdachbau, bezeichnet 1805, Toranlage, bezeichnet 1807",49.440918,7.87209
Hauptstraße 123/125,Hochspeyer,"Gasthaus, um 1800ff; großer Vierseithof, Hauptgebäude mit Krüppelwalmdach",49.440918,7.87209
Hauptstraße 132,Hochspeyer,"Gasthaus „Zu den Drei Königen“; teilweise Fachwerk, bezeichnet 1836, im Kern wohl von vor 1740",49.440918,7.87209
Hauptstraße 142,Hochspeyer,"spätbarockes Wohnhaus mit verschieferten Fachwerkgiebeln, bezeichnet 1791; Breitgaube spätes 19. Jahrhundert",49.440918,7.87209
Hauptstraße 145,Hochspeyer,"Villa; eineinhalbgeschossiger spätgründerzeitlicher Klinkerbau, bezeichnet 1897",49.440918,7.87209
Kirchstraße 7,Hochspeyer,"Protestantische Pfarrkirche; spätbarocker Saalbau, 1770, Turm, Rotsandsteinquader, bezeichnet 1870",49.440912,7.871497
Münchhofstraße 8,Hochspeyer,"Unterstallhaus, eingeschossiges Unterstallhaus, bezeichnet 1844",49.44216,7.897629
Münchhofstraße 35,Hochspeyer,"Einfirstanlage; Krüppelwalmdachbau, Fachwerk, 18. Jahrhundert",49.440256,7.90186
Münchhofstraße 39,Hochspeyer,"sogenannter Münchhof; 18. Jahrhundert; barocker Krüppelwalmdachbau, Fachwerk, bezeichnet 1740, Stallscheune mit Krüppelwalmdach",49.440168,7.902246
Weiherstraße 11,Hochspeyer,"Hofanlage; Streckhof mit eingeschossigem Wohnhaus, bezeichnet 1789, im 19. Jahrhundert überformt",49.440654,7.89382
am westlichen Ortsrand,Hochspeyer,"sogenanntes Torstenson-Kreuz; spätgotisches Sandsteinkreuz, um 1420",49.443396,7.892293
"zwischen Bahn und B 37, westlich des Ortes",Hochspeyer,"Wittelsbacher Denkmal; Sandstein-Obelisk, bezeichnet (1180-)1880",49.290176,8.682172
Hauptstraße 102,Hütschenhausen,"Protestantische Kirche; Saalbau, 1933/34, Architekt Willi Hemmer, Kaiserslautern",49.419544,7.476687
Hauptstraße 104/106,Hütschenhausen,"ehemalige Schule; langgestreckter spätklassizistischer Putzbau, Mitte des 19. Jahrhunderts",49.419368,7.476507
Hauptstraße 112,Hütschenhausen,"Villa; stattliche spätgründerzeitliche Walmdachvilla, bezeichnet 1901",49.419216,7.475394
Hauptstraße 119,Hütschenhausen,"Gasthaus Kurz; spätbarocker Mansarddachbau mit Krüppelwalmen, in den Felsen gehauener Keller, Anbau, bezeichnet. 1871",49.4189,7.474953
Hauptstraße 120,Hütschenhausen,"Hofanlage, Hakenhof; nachbarockes Wohnhaus, bezeichnet 1805, Scheune zweite Hälfte des 19. Jahrhunderts",49.418788,7.473974
(an) Hauptstraße 125,Hütschenhausen,"gründerzeitliches Portal, bezeichnet 1874",49.418677,7.474046
Hauptstraße 127,Hütschenhausen,"Hofanlage, 19. Jahrhundert; nachbarockes Wohnhaus, teilweise Fachwerk, bezeichnet 1844",49.418589,7.473282
Hauptstuhler Straße 4,Hütschenhausen,"spätgründerzeitliche Einfirstanlage, bezeichnet 1901 (?)",49.418987,7.481772
Kirchenstraße 25,Hütschenhausen,"Katholische Pfarrkirche St. Michael; zentralisierender, dreischiffiger Sandsteinquaderbau, romanisierender Heimatstil, 1911–13, Architekt Rudolf von Perignon, München",49.421566,7.484826
Brunnenstraße 22,Katzenbach,"ehemalige Schule; eingeschossiger Zweiflügelbau, Heimatstil, bezeichnet 1911",49.432125,7.515575
Ramsteiner Straße 42,Spesbach,"ehemaliges Gasthaus Pletsch; spätgründerzeitlicher Krüppelwalmdachbau, Bruchstein, bezeichnet 1899",49.426289,7.503816
Ramsteiner Straße 45,Spesbach,"Hofanlage, Vierseithof, 19. Jahrhundert; klassizistisches Wohnhaus, bezeichnet 1828",49.426037,7.502002
Ramsteiner Straße 57,Spesbach,"Protestantische Pfarrkirche; barocker Saalbau, 1746, Turm aus dem 13. Jahrhundert",49.4266,7.503924
Bachstraße ohne Nummer,Katzweiler,"ehemalige Mühle; Dreiflügelanlage, um 1830/40, im Kern wohl älter; Krüppelwalmdachbau, teilweise Fachwerk, mit Mühlenteil; Wasserrad; Ökonomiegebäude, Rotsandstein",49.503462,7.699838
Hauptstraße,Katzweiler,"Kilometerstein, Sandstein-Zylinder, 19. Jahrhundert",47.540529,8.824735
Hauptstraße,Katzweiler,"Kriegerdenkmal 1914/18, 1920er Jahre",47.540529,8.824735
Hauptstraße 23,Katzweiler,"Hofanlage, Hakenhof, erste Hälfte des 19. Jahrhunderts; eingeschossiges klassizistisches Wohnhaus, teilweise Fachwerk, bezeichnet 1815",47.539914,8.821447
Hauptstraße 36,Katzweiler,"ehemaliger Lehnshof der Grafen von der Leyen; Einfirstanlage, bezeichnet 1732, wohl im späten 18. Jahrhundert verändert",47.545875,8.843088
Hauptstraße 51,Katzweiler,"Protestantische Pfarrkirche; klassizistischer Saalbau, 1822–26, Kreisbauinspektor Friedrich Samuel Schwarze",47.540699,8.824753
Hauptstraße 55,Katzweiler,"Protestantisches Pfarrhaus; spätklassizistischer Walmdachbau, 1854",47.09193,7.455253
Hauptstraße 86,Katzweiler,"Katholische Kuratiekirche Mariä Himmelfahrt; romanisierender Saalbau, 1936, Architekt Paul Klostermann, Kaiserslautern",47.863749,16.376674
(an) Hebelstraße 2,Katzweiler,"Portal, barockes Oberlicht-Portal, bezeichnet 1726",49.502129,7.699775
"Mehlbacher Straße, auf dem Friedhof",Katzweiler,"Grabmal J. K. und H. Henn, gründerzeitliche Schauwand mit Ädikula, um 1902; Grabmal Hübner, Grabstele mit Relief einer Trauernden, Neurenaissance, 1890/1900; Grabmal D. und H. Christmann, Schauwand mit Reliefstele, um 1910",49.505604,7.696864
Storcheneckerstraße 3,Katzweiler,"ehemalige katholische Kirche mit Schule; spätklassizistischer Walmdachbau, 1838",49.502924,7.696855
an der B 270,Katzweiler,"Sonnenhof; Dreiseithof; eingeschossiger Krüppelwalmdachbau mit Kniestock, 1845, langgestreckter Scheunen-Stall-Trakt, bezeichnet 1838",54.137362,10.495574
Kühbörncheshof,Katzweiler,"Mennonitenkirche; Saalbau, Krüppelwalmdach, bezeichnet 1832",49.499648,7.674164
Schafmühle 1,Katzweiler,"Hofanlage; langgestrecktes spätklassizistisches Wohnhaus, um 1860, Mahlmühle 1897",49.507458,7.687324
Schafmühle 2,Katzweiler,"Schafmühle; ehemalige Ölmühle; klassizistischer Krüppelwalmdachbau, bezeichnet 1807",49.50754,7.686902
Eisenbahnstraße 18,Kindsbach,"Katholische Pfarrkirche Mariä Heimsuchung; romanisierende Basilika, 1912/13, Architekt Rudolf von Perignon, 1965–68 erweitert und innen umgebaut",49.422773,7.613518
"Friedhofstraße, auf dem Friedhof",Kindsbach,"Kriegerdenkmal 1914/18 und 1939/45, 1950er Jahre, Heiliger Michael",49.416784,7.607823
Kaiserstraße 65,Kindsbach,"barockes Fachwerk-Wohn- und Geschäftshaus, zweite Hälfte des 18. Jahrhunderts; gründerzeitliche Haustür",49.426687,7.645741
"Kaiserstraße, Ecke Kreuzstraße",Kindsbach,"Wegekreuz, barock auf Rokokosockel, bezeichnet 1747",49.426687,7.645741
Bärenloch,Kindsbach,"Maximilianstein; Sandsteinkubus, bezeichnet 1818",46.847888,9.532446
Bergstraße 8,Kollweiler,"Protestantische Kirche; gotischer Saalbau, 14. Jahrhundert, barocker Dachreiter",49.515208,7.578664
gegenüber Hoftstraße 12,Kollweiler,"Gosenbergerhof; Hakenhof, Rotsandsteinquaderbauten, Ende des 19. Jahrhunderts; Scheune bezeichnet 1897","",""
auf dem Friedhof,Kottweiler,"Grabmal Kneller, Schauwand mit großer Engelsfigur, wohl aus den 1920er Jahren",49.476034,7.538599
Kirchenweg 2,Kottweiler,"Katholische Kirche St. Elisabeth; zweischiffiger Bau, barockisierender Heimatstil, 1927/28, Architekt Hans Seeberger, Kaiserslautern; einheitliche Baugruppe mit Pfarrhaus, Walmdachbau, 1928",49.475004,7.536353
Steinwendener Straße 9,Kottweiler,"sogenannter Altenhof; eingeschossige spätklassizistische Einfirstanlage, bezeichnet 1846",49.473307,7.537323
Steinwendener Straße 30,Kottweiler,"Mittlere Kottweiler Mühle, sogenannte Walzenmühle Munzinger; spätklassizistischer Bau, bezeichnet 1897; viereinhalbgeschosssiges Mühlengebäude nach 1930",49.469215,7.535176
Steinwendener Straße 32/33,Kottweiler,"Untere Kottweiler Mühle; spätklassizistische Baugruppe, zweite Hälfte des 19. Jahrhunderts",49.467447,7.532302
Turmstraße,Kottweiler,"Wasserbehälter; spätgründerzeitlicher Sandsteinquaderbau, um 1900",49.472979,7.542381
Turmstraße,Kottweiler,"Gemeindeglockenturm; gotisierender Sandsteinquaderbau, bezeichnet 1894",49.472979,7.542381
Friedhofstraße,Schwanden,"Wegekreuz, Fünfwundenkreuz, bezeichnet 1861",49.483796,7.53214
Reichenbacher Straße 67,Schwanden,"Schule; stattlicher spätklassizistischer Walmdachbau, um 1870/80",49.481057,7.537099
Bergstraße 2,Lambsborn,"Einfirstanlage, teilweise Fachwerk, erste Hälfte des 19. Jahrhunderts (im Kern aus dem 17. oder 18. Jahrhundert?), ehemaliges Wirtschaftsgebäude, Rotsandstein, 19. Jahrhundert",49.367406,7.429804
Obere Hauptstraße 7,Lambsborn,"barocker Streckhof, im Kern aus dem späten 18. Jahrhundert, bezeichnet 1868",48.048558,16.941112
