Eckstraße 2,Langwieden,"Hakenhof; eingeschossiges Wohnhaus, 1867, Scheune teilweise Fachwerk",49.375648,7.499334
Hauptstraße 1,Langwieden,"Hofanlage, Hakenhof; klassizistisches Einfirsthaus, um 1830; Ortseingangssituation",49.373466,7.500906
Hauptstraße 2,Langwieden,"Protestantische Kirche; ehemals St. Bartholomäus, romanischer Chorflankenturm und Maßwerkfenster aus dem 14. Jahrhundert, Langhaus wohl Anfang des 19. Jahrhunderts erweitert; in der Ostseite Viergötterstein",49.374276,7.500528
Hauptstraße 4,Langwieden,"Dreiseithof; spätbarockes Wohnhaus, bezeichnet 1791, barocke Scheune",49.37478,7.501121
Hauptstraße 5,Langwieden,"Dreiseithof; spätklassizistisches Wohnhaus, bezeichnet 1858",49.374035,7.500457
Hauptstraße 8,Langwieden,"Hakenhof; eingeschossiges Einfirsthaus, 1845",49.375308,7.499944
Hauptstraße 13,Langwieden,"Hofanlage; barockes Fachwerkhaus, im Kern wohl aus dem 17. Jahrhundert, Scheune bezeichnet 1882",49.375108,7.499558
(an) Hauptstraße 15,Langwieden,"klassizistisches Haustürblatt, 1825",49.374827,7.499262
