Andernacher Straße,Kettig,"Katholische Pfarrkirche St. Bartholomäus; viergeschossiger spätgotischer Turm, barocker Helm, um 1723; zweischiffige Halle, wohl um 1470, Verlängerung 1899; an der Westseite Kreuz, 1781",50.401158,7.45802
(bei) Breitestraße 15,Kettig,"Wegekreuz, bezeichnet 1889",50.936558,8.099139
Breitestraße 16,Kettig,"Backsteinbau, Basalt- und Terrakottagliederung, um 1900",47.490528,8.73264
Breitestraße 21,Kettig,"Fachwerkhaus, verputzt, Krüppelwalmdach, bezeichnet 1834",47.489675,8.731831
Breitestraße 26,Kettig,"Hakenhof; Fachwerkhaus, teilweise massiv, Krüppelwalmdach, bezeichnet 1783; bauliche Gesamtanlage",47.490029,8.730529
"Breitestraße, Ecke Kärlicher Straße",Kettig,"Wegekapelle, Kreuze, Grenzsteine",47.490315,8.725507
Kärlicher Straße 2,Kettig,"Basaltbruchsteinvilla, um 1900; Gesamtanlage mit Garten",50.40923,7.471315
