(bei) Im Haussauer Tal 6,Arenrath,"Kreuzigungsbildstock, bezeichnet 1713","",""
"Kirchstraße, auf dem Friedhof",Arenrath,"Schaftkreuz, bezeichnet 1742; Heiligenhäuschen, Rotsandstein, 18. Jahrhundert",48.074934,8.643239
Kirchstraße 3,Arenrath,"Wohnhaus, zweite Hälfte des 19. Jahrhunderts",49.952805,6.741578
Kirchstraße 5,Arenrath,"Katholische Pfarrkirche St. Alexius; vierachsiger klassizistischer Saalbau, 1855; Kriegerdenkmal, Erster und Zweiter Weltkrieg",49.952486,6.741578
"(neben) Hof Hütt 9, in Hütt nördlich der Ortslage",Arenrath,"Kapelle; Putzbau mit Dachreiter, bezeichnet 1910",49.966366,6.745979
nordöstlich der Ortslage,Arenrath,"Oberer Hof Mellich; Hofhaus, bezeichnet 1792, Umfassungsmauern und Hofgebäude älter",49.952956,6.742126
südlich der Ortslage an der Straße nach Niersbach,Arenrath,"Wegekapelle; Putzbau, bezeichnet 1894; Kreuzigungsbildstock, Rotsandstein, bezeichnet 1695",51.9335,12.225388
