Denkmalzone Jüdischer Friedhof (Koblenzer Straße),Thalfang,von einer Hecke umgebenes Areal mit fünf bis zehn Grabsteinen und älterem Baumbestand,49.7541,6.996717
Charlottenhöhe 1,Thalfang,"ehemaliger Bahnhof; Typenbau, Bruchstein- und Putzflächen, Fachwerkgiebel, Fachwerkgüterschuppen, Anfang des 20. Jahrhunderts",49.749449,7.00235
Friedhofstraße 6,Thalfang,"angeblich ehemaliges Küsterhaus; Krüppelwalmdachbau, 18. Jahrhundert",49.754758,6.996205
Hauptstraße 21,Thalfang,"stattliches Quereinhaus, bezeichnet 1846",49.754548,6.995379
Kirchgasse,Thalfang,"Evangelische Pfarrkirche; dreischiffige Pseudobasilika, erste Hälfte des 14. Jahrhunderts, spätgotischer Chor, Westturm vom Anfang des 13. Jahrhunderts, im 16. Jahrhundert erhöht; am Kirchhofeingang kleiner Torbau mit geschweiftem Dach, 18. Jahrhundert",49.754478,6.99652
Lückenburger Straße 10,Thalfang,"Katholische Pfarrkirche St. Matthäus, neugotischer Saalbau, 1899 bis 1901",49.752086,6.997445
östlich oberhalb der Ortslage,Thalfang,"Kriegerdenkmal 1914/18; offenes Bruchsteinoktogon, nach 1945 erweitert",49.7541,6.996717
