Hauptstraße 4, Schöneberg (Westerwald),"Fachwerkhaus, teilweise massiv, 17. oder Anfang des 18. Jahrhunderts, erweitert in der ersten Hälfte des 19. Jahrhunderts"
Hauptstraße 11, Schöneberg (Westerwald),"Evangelische Pfarrkirche, 1864, Turm 1906–08"
Alter Weg 37, Schutzbach,"Wohnhaus, Zierfachwerk, 1910er Jahre"
Schulstraße 11, Schutzbach,"Fachwerkhaus, 18. Jahrhundert"
Schulstraße 23, Schutzbach,"ehemalige Schule; teilweise Zierfachwerk, 1917"
Niederseelbach 7, Seelbach bei Hamm (Sieg),"Fachwerkhaus, teilweise verschiefert, erste Hälfte des 19. Jahrhunderts"
Am Kloster 20, Seelbach bei Hamm (Sieg),"stattliches Fachwerkhaus, 18. Jahrhundert"
Klosterpforte 10, Seelbach bei Hamm (Sieg),"kleines Fachwerkhaus, 19. Jahrhundert"
Bahnhofstraße 3, Seelbach (Westerwald),"ehemaliger Bahnhof Flammersfeld; Walm- und Satteldachdachbau, Fachwerk-Lagerschuppen mit Backsteinausmauerung, gegen 1910"
Hauptstraße, Seelbach (Westerwald),"dreibogige Brücke, wohl aus dem 19. Jahrhundert"
Hauptstraße 10, Seifen (Westerwald),"Streckhof; Fachwerkhaus, Mitte des 19. Jahrhunderts"
In der Hohl 1, Seifen (Westerwald),"Fachwerk-Quereinhaus, teilweise massiv, um 1700"
südlich der Ortslage, Seifen (Westerwald),"ehemaliger Bahnhof; stattliches Empfangsgebäude, Backstein, um 1900"
Hauptstraße 17, Sörth,"Fachwerk-Quereinhaus, 18. oder Anfang des 19. Jahrhunderts"
