Denkmalzone Jüdischer Friedhof[1] (Am Judenkirchhof), Hundsbach,Areal mit etwa 50 Grabsteinen des 18. und 19. Jahrhunderts
Hauptstraße 7, Hundsbach,"evangelische Kirche; neuromanischer Sandsteinquaderbau, 1867, nach 1945 Wiederaufbau; Stützmauer, Sandsteinquader; Kriegerdenkmal 1914/18"
Hauptstraße 3, Hundsbach,"ehemalige Schule; spätklassizistischer Walmdachbau, Mitte des 19. Jahrhunderts"
Hauptstraße 12, Hundsbach,"ehemaliges Gasthaus; in der Art einer Einfirstanlage mit Tanzsaal, bezeichnet 1830, Fachwerk-Anbau"
Untergasse 4, Hundsbach,"ehemaliges evangelisches Pfarrhaus; spätklassizistischer Putzbau, Ende des 19. Jahrhunderts"
(bei) Untergasse 9, Hundsbach,"ehemalige Synagoge; Sandsteinquaderbau mit Rundbogenmotiven, 1880"
"am Kirchhof, nächst der L 182 (auf dem Friedhof)", Hundsbach,"Grabstein J. Forster, Sandstein, 1949"
