Denkmalzone Burgruine Dalberg,westlich des Ortes,Dalberg (bei Bad Kreuznach),1150!um 1150,"von der um 1150 gegründeten, 1635 oder 1689 zerstörten Anlage in Teilen erhalten: romanischer Bergfried, Palas, Wohngebäude, „Langer Saal“, 14. Jahrhundert, ehemalige Antoniuskapelle mit Eckturm, „Dietherbau“ mit „Dietherturm“, vor 1371 und vor 1398; zwei Pfeiler einer Wasserleitung[1]",Kein Bild vorhanden,49.896052,7.729939
Katholische Kirche St. Leonhard,Gräfenbachstraße 22,Dalberg (bei Bad Kreuznach),1485,"spätgotischer Saalbau, bezeichnet 1485, barocke Westverlängerung, bezeichnet 1785; an der Kirche Kruzifix, 19. Jahrhundert",Kein Bild vorhanden,49.896279,7.732621
Hofanlage,Gräfenbachstraße 24,Dalberg (bei Bad Kreuznach),1750!Mitte des 18. Jahrhunderts,"Einfirstanlage, teilweise Fachwerk, Mitte des 18. Jahrhunderts, Wirtschaftsgebäude; städtebaulich wichtige Ecklage",Kein Bild vorhanden,49.896064,7.732371
Gemeinde- und Backhaus,Gräfenbachstraße 41,Dalberg (bei Bad Kreuznach),1849,"Gemeinde- und Backhaus, bezeichnet 1849",Kein Bild vorhanden,49.895461,7.731371
Brücke,"Gräfenbachstraße, zwischen Nr. 41 und 43",Dalberg (bei Bad Kreuznach),1700!18. oder 19. Jahrhundert,"Brücke über den Gräfenbach, einbogige Brücke, Bruchstein, 18. oder 19. Jahrhundert",Kein Bild vorhanden,49.895331,7.731306
Madonnensäule,westlich des Ortes am Weg zur Burgruine,Dalberg (bei Bad Kreuznach),1728,"Madonnensäule, barock, bezeichnet 1728",,49.896263,7.730925
