Deslocher Straße,Jeckenbach,"Brücke, einbogig, Bruchstein, wohl aus der ersten Hälfte des 19. Jahrhunderts"
Mühlstraße,Jeckenbach,"Brücke, einbogig, Sandsteinquader, wohl aus der zweiten Hälfte des 19. Jahrhunderts"
Mühlstraße,Jeckenbach,"evangelische Kirche; spätbarocker Saalbau, bezeichnet 1767, Architekt eventuell Philipp Heinrich Hellermann, Westturm im Kern romanisch, 11. oder 12. Jahrhundert, Glockenstube und Turmhelm barock; klassizistischer Treppenaufgang, 1852"
(bei) Mühlstraße 5,Jeckenbach,"Brücke, einbogig, wohl aus der Mitte des 19. Jahrhunderts"
Mühlstraße 9,Jeckenbach,"Streckhof; Fachwerkhaus, verputzt, bezeichnet 1841, Scheune, bezeichnet 1833"
(gegenüber) Mühlstraße 10,Jeckenbach,"barockes Fachwerkhaus, verputzt, 18. Jahrhundert"
"südöstlich des Orts, im Stried",Jeckenbach,"sogenannter Römerbrunnen; Schöpfbrunnenanlage, angeblich römerzeitlich"
nördlich des Ortskerns,Jeckenbach,"Weinbergshaus; historisierender Satteldachbau, wohl aus den 1920er Jahren"
