Lützelsoonstraße,Kellenbach,"evangelische Pfarrkirche; ehemals St. Veit, romanischer Westturm, spätgotischer Chor, erste Hälfte des 15. Jahrhunderts, spätbarocker Saal, 1765"
Lützelsoonstraße,Kellenbach,"Wasserbehälter; teilweise Fachwerk, Heimatstil, bezeichnet 1913"
Lützelsoonstraße 1,Kellenbach,"barockes Fachwerkhaus, teilweise massiv, abgewalmtes Mansarddach, bezeichnet 1739; gegenüber Stall, teilweise Fachwerk, 19. Jahrhundert"
Lützelsoonstraße 6,Kellenbach,"ehemalige evangelische Pfarrscheune; Bruchstein, wohl aus dem 19. Jahrhundert"
Schiefersteinstraße,Kellenbach,"katholische Kirche St. Hildegard; kleiner Walmdachbau, Bruchstein, Jugendstil, 1912, Architekt Peter Marx, Trier"
Schiefersteinstraße 14,Kellenbach,"Gasthaus; einfirstartiger Fachwerkbau, bezeichnet 1868, Tanzsaal 1920er Jahre"
(an) Schiefersteinstraße 57,Kellenbach,"Haustür, neugotisches Türblatt, bezeichnet 1883"
am Simmerbach,Kellenbach,"Rippas Mühle; eingeschossiger Krüppelwalmdachbau, teilweise Fachwerk, im Kern eventuell aus dem 18. Jahrhundert"
