"Bahnhofstraße 50/52, 55; bauliche Gesamtanlage",Ellern (Hunsrück),"
Nr. 50/52: Villa, teilweise verschiefert, um 1910/20, Park mit Bedienstetenhaus
Nr. 55: Fachwerk-Ökonomietrakt, bezeichnet 1936, Verwaltungsgebäude, Walmdachbau, teilweise Fachwerk

",52.207152,8.690706
Nr. 50/52,Ellern (Hunsrück),"Villa, teilweise verschiefert, um 1910/20, Park mit Bedienstetenhaus",52.306347,8.130301
Nr. 55,Ellern (Hunsrück),"Fachwerk-Ökonomietrakt, bezeichnet 1936, Verwaltungsgebäude, Walmdachbau, teilweise Fachwerk",51.949223,8.985084
Im Haferacker 4,Ellern (Hunsrück),"Fachwerk-Quereinhaus, teilweise massiv, bezeichnet 1736",49.985136,7.639938
"Rheinböllener Straße, auf dem alten Friedhof",Ellern (Hunsrück),"Kriegerdenkmal, Grabmäler, Pfarrergrabmal, um 1881, Stele; Grabmal Höltz, Stele",49.987279,7.641447
Rheinböllener Straße 4,Ellern (Hunsrück),"ehemaliges Gasthaus „Zur Post“; stattliches Fachwerk-Quereinhaus, verputzt, abgewalmtes Mansarddach, um 1800, Stall/Scheune 19. Jahrhundert",49.987169,7.641411
Simmerner Straße 2,Ellern (Hunsrück),"Altes Rathaus; Mansardwalmdachbau, Fachwerk verputzt oder verschiefert, 18. Jahrhundert",49.986804,7.64063
Simmerner Straße 6,Ellern (Hunsrück),"Backhaus; eingeschossiger Bruchsteinbau, 19. Jahrhundert",49.986665,7.640279
Simmerner Straße 7,Ellern (Hunsrück),"Evangelische Kirche; klassizistischer Saalbau, 1827–29, Architekt Ferdinand Nebel, Koblenz",49.986098,7.63939
