Denkmalzone Hunsrückbahn,Halsenbach,"Teilstück der 1906–08 errichteten Bahnstrecke, eines der steilsten Streckenstücke der Preußischen Staatsbahn; an der K 110 nordöstlich des Ortes: Dörther Brücke, dreibogige Sandsteinquaderbrücke, 1908",50.173489,7.553035
"Ehrer Straße, auf dem Friedhof",Halsenbach,"Kreuz, Basalt, barocker Korpus; Grabkreuz, Basalt, 1750",50.176028,7.552828
Hinter dem Rathaus 1,Halsenbach,"Kirche St. Lambertus; Saalbau, 1758/59, Architekt A. Seiz, Erweiterung 1835–38, nördliche Seitenschiffkapelle 1896, Wiederherstellung 1923, Erweiterung 1960–62, Architekt O. Vogel, Turm und Portal des Vorgängers, bezeichnet 1713; am Chor barocker Kruzifix; bauliche Gesamtanlage mit Pfarrhaus",50.176218,7.550017
(bei) Hinter dem Rathaus 2,Halsenbach,"Kreuz, Schmiedeeisen, 18. Jahrhundert",50.176126,7.549999
"an der K 110, nordöstlich des Ortes",Halsenbach,"Dörther Brücke; dreibogige Brücke, 1908",49.160943,11.261586
Im Hof 3,Halsenbach,"Fachwerkhaus, teilweise massiv, 19. Jahrhundert, Anbau des 19. Jahrhunderts",50.176807,7.568019
an der K 112 nach Kratzenburg,Halsenbach,Eisenbahnbrücke; steinerne Brücke der Hunsrückbahn,49.160943,11.261586
