Hauptstraße 3,Roth (Rhein-Hunsrück-Kreis),"ehemalige Schule; Putzbau, teilweise Fachwerk, um 1910",48.787878,8.342295
Im Dorf 21,Roth (Rhein-Hunsrück-Kreis),"Fachwerk-Quereinhaus, erste Hälfte des 19. Jahrhunderts",49.586045,8.354422
Im Dorf 27,Roth (Rhein-Hunsrück-Kreis),"Hofanlage; Fachwerkhaus, teilweise massiv und verschiefert, Anfang des 19. Jahrhunderts, Fachwerkscheune 19. Jahrhundert",49.586045,8.354422
Im Dorf 36,Roth (Rhein-Hunsrück-Kreis),"Evangelische Kirche; Saalbau, 1661/62, nach Zerstörungen im Laufe des Pfälzischen Erbfolgekrieges (1689) Reparaturen des Glockenturmes im Jahre 1704; Neuaufbau der Kirche 1718; erneute Zerstörung durch ein Unwetter und Wiederaufbau 1720, weitere Baumaßnahmen am Dach und Anbau des Chores im 18. Jahrhundert; 1769 Fertigstellung der Orgel durch Orgelbauer Stumm aus Kastellaun; außen Grabplatte, 1621; bauliche Gesamtanlage mit Friedhof",49.587166,8.35426
Im Dorf 46,Roth (Rhein-Hunsrück-Kreis),"Backhaus, eingeschossiger Fachwerkbau, 19. Jahrhundert",49.587166,8.35426
Kastellauner Weg 1,Roth (Rhein-Hunsrück-Kreis),"Hakenhof; Fachwerkhaus, teilweise verschiefert, abgewalmtes Mansarddach, Anfang des 19. Jahrhunderts, Fachwerkscheune",50.086455,7.457104
am Weg zur Günnewig Mühle,Roth (Rhein-Hunsrück-Kreis),einbogige Bruchsteinbrücke,49.246787,11.090843
