Denkmalzone Altes Gaswerk (Weisenauer Straße 15), Mainz-Oberstadt,"ehemaliges Gaswerk der Stadt Mainz auf der ehemaligen Anlage der Favorite; Südostfront: zwei Wehrbauten, Ostseite: neugotische Rotsandsteinquaderbauten in Pavillonbauweise, 1853–55, Architekt Joseph Dörr"
"Denkmalzone Am Fort Josef 2, 1–5 (ungerade Nummern), Am Linsenberg 2–6 (gerade Nummern), Am Römerlager 25–43 (ungerade Nummern), 28–40 (gerade Nummern), Augustusstraße 1–3 (ungerade Nummern), Hochgesandstraße 1, Langenbeckstraße 28–38 (gerade Nummern)", Mainz-Oberstadt,"Wohngebiet auf dem Höhenplateau zwischen barockem Bastionenring und dem barocken Außenfort, entstanden ab 1920 für verschiedene Bauträger, offene Blockbebauung in neubarocker Gestaltung in der Art des Heimatstils, zweigeschossige Putzbauten mit ausgebauten Mansarddächern, Vorgärten im Blockinneren Wirtschaftgärten, Baumreihen zur Abgrenzung der Fahrbahn"
"Denkmalzone Am Gautor 15, Kästrich 1–5 (ungerade Nummern)", Mainz-Oberstadt,"neubarocke Blockrandbebauung aus Wohn- und Geschäftshäusern an der Ecke Kästrich/Am Gautor, die westliche Flanke des geplanten neuen Stadteingangs anstelle des 1896 abgebrochenen und translozierten Gautors"
"Denkmalzone Am Klostergarten 1–15 (ungerade Nummern); 2–6 (gerade Nummern); Am Rosengarten 8–14 (gerade Nummern) und 13–31 (ungerade Nummern); Am Stiftswingert 3, 5; Auf dem Albansberg 2; Hechtsheimer Straße 64–78 (gerade Nummern)", Mainz-Oberstadt,"Wohnhausbauten für französische Offiziersfamilien, 1919–21 im Auftrag des Reichsvermögensamtes von verschiedenen Mainzer Architekten erstellt, rhythmisch gruppiert, zweigeschossige Massivbauten in klassizistischen Formen, Architekturteile aus Kunststein, verschieferte Walmdäche, zugehörig die Gärten"
"Denkmalzone An der Favorite 2, 4, Göttelmannstraße 56", Mainz-Oberstadt,"Gruppe von 1922 durch die Reichsvermögenverwaltung errichtete Bauten für französische Offiziersfamilien, drei zweigeschossige Zweispänner, Putzbauten mit sparsamen Sandsteingliederungen und Walmdächern an städtebaulich markanter Stelle"
"Denkmalzone An der Karlsschanze 5, 7, 10, 12, 14, 16, Am Rosengarten 2, 4, Auf dem Albansberg 8, 10, 12", Mainz-Oberstadt,"bevorzugte Villengegend des Mainzer Großbürgertums, qualitätvolle Villenbauten auf großen Grundstücken, Darmstädter Jugendstil, Neubarock und Landhausstil, teilweise bauzeitliche Einfriedungen, 1909–14; straßenbildprägend"
"Denkmalzone Auf der Bastei 1, 2, 3", Mainz-Oberstadt,"Ensemble aus Einzelvilla (Nr. 2, ehemalige Villa Jung) und den Zwillingsvillen Nr. 1 und 3 (ehemalige Villen Behnke) in beherrschender Lage im südlichen Teil der einstigen Bastion Alexander, 1913 errichtet"
"Denkmalzone Auf der Steig 2/4, 6/8, 10, 12/14, Am Frankenhag 11/13", Mainz-Oberstadt,"anspruchsvolle Wohnhaussiedlung in reichem Landhausstil, 1909/10 von der „Reichskommission für die Mainz-Kasteler Festungsgrundstücke“ von Paul Kubo entworfen; drei Doppelhäuser, ein Einzelhaus, geschlossene Einfriedung; zu Auf der Steig 4: Pavillon mit neubarocker Nischenädikula, Statue des heiligen Alban"
"Denkmalzone Backhaushohl 2, 4, 6 und 8", Mainz-Oberstadt,"um den Kirchhof der Pfarrkirche St. Achatius gruppierte schlichte Häuser (Nr. 2 Krüppelwalmdachbau, 1834; Nr. 6 zwei Wohnhäuser aus der ersten Hälfte und der Mitte des 19. Jahrhunderts, 1895 und 1892 umgebaut; Nr. 8 bescheidener Putzbau, Mitte des 19. Jahrhunderts), die in Anordnung, Größe und Gestaltung ein Bild vom Zahlbach des 19. Jahrhunderts bieten"
"Denkmalzone Bastion Martin 4/6, 14–20 (gerade Nummern), Drususstraße 2/4, Martinsstraße 2", Mainz-Oberstadt,"zwei Baublöcke, ab 1921 von der Reichsvermögensverwaltung für französische Offiziers- und Unteroffiziersfamilien errichtet nach Plänen von Architekten der Arbeitsgemeinschaft Bastion Martin; drei- und viergeschossige Putzbauten in klassizierenden Großformen, zum Teil Kunststeinreliefs über den Eingängen"
Denkmalzone Bretzenheimer Straße 2 und 6, Mainz-Oberstadt,"kleine Gebäudegruppe am Ortsrand von Zahlbach bei der Mündung von Mühlweg und Schaftriebweg und - nicht mehr sichtbar - den Gewässern Wildgraben und Zeybach (Nr. 2 Putzbau mit Fachwerkobergeschoss, 19. Jahrhundert, Zwerchhaus jünger; Nr. 6 breitgelagerter Putzbau, 19. Jahrhundert), mit altem Wege- und Gewässerverlauf von ortsgeschichtlicher Bedeutung"
"Denkmalzone Ebersheimer Weg 7–25 (ungerade Nummern) und 8–30 (gerade Nummern), Kreuzschanze 2–8 und 10–28 (gerade Nummern), Martin-Luther-Straße 40–44 und 46–50 (gerade Nummern)", Mainz-Oberstadt,"Reihenhaussiedlung, 1928/29 von der Siedlungsgesellschaft für das Verkehrspersonal GmbH, Darmstadt (Siege), von F. W. Schieker und Kleinschmitt; in Zeilenhausschema geordnete Kleinhäuser, zweigeschossig mit ziegelgedeckten Satteldächern, an den Ecken dreigeschossige, flach gedeckte Kopfbauten; einschließlich der durch Hecken eingefassten Vorgärten und rückwärtig liegenden Hausgärten"
"Denkmalzone Görz-Stiftung (Untere Zahlbacher Straße 10–16, 18/20 und 22–28, Am Dalheimer Kloster 1/3, Eupener Straße 1/3, 2/4 und 5, Görzstraße 1/3 und 2/4, Lindenschmittstraße 21/23, 25/27 und 29–33)", Mainz-Oberstadt,"symmetrisch angelegte Siedlung des Bau- und Sparvereins Mainz mit elf eng stehenden drei- oder viergeschossigen Mehrfamilienhäusern in verhaltenem Heimatstil, mit begrünten Innenhöfen, zwischen 1903 und 1937, gut erhaltenenes Beispiel des genossenschaftlichen Wohnungsbaus"
Denkmalzone Grüngürtel-Promenade, Mainz-Oberstadt,"Parkanlage auf dem Gebiet der 1904 aufgegebenen Festungswerke und Umfassung des Bastionen-Tracé zwischen Römerwall und Auf der Steig nach Plänen von Friedrich Pützer, 1930 aufs Doppelte verbreitert zwischen Römerwall und Jägerstraße und mit Freizeitanlagen ausgestattet (Planschbecken, Liegewiese, Turnplatz); innerhalb der Anlage außerdem neubarockes Pumphaus, kubischer Ziegelbau mit Haubendach; Peter-Cornelius-Denkmal, 1930 von Hugo Lederer; Denkmal der in beiden Weltkriegen Gefallenen des 2. nassauischen Infanterieregiments Nr. 88 mit Spolien des zerstörten Denkmals von 1931"
"Denkmalzone Hauptfriedhof (Saarstraße, Untere Zahlbacher Straße)", Mainz-Oberstadt,"1803 angelegt, 1831, 1847/48, 1873, 1893/94, 1918 erweitert, planmäßig in rechtwinklige Felder aufgeteiltes Areal, die durchgehenden Wege von Linden gesäumt; älteste erhaltene Grabsteine von 1805–07, Belegung der Grüfte ab 1850; große Zahl qualitätvoller Grabmäler, Grüfte und Denkmäler; Krematorium 1903, Architekt Josef Hassinger, monumentaler Kuppelbau in klassischen Architekturformen, Friedhofstor mit Sphingen; öffentliche Grabmäler: Kreuzigungsgruppe, 1815; helmbekröntes Veteranendenkmal, 1834; Preußendenkmal (1848) und Denkmal der Pulverturmexplosion (1857); Prinz-Holstein-Denkmal, 1872, Entwurf Eduard Kreyßig, Galvanoplastik von Heinrich Barth; Großes Franzosen-Denkmal (1870/71), Fiale mit Trophäen- und Kreuzaufsatz; Deutsches Kriegerdenkmal, 1873, Entwurf Eduard Kreyßig; Hessisches Kriegerdenkmal, 1882, Obelisk, Entwurf E. Marx; Pietà, 1895; ehrenhofartige Anlage, 1909, und so genanntes Kleines Franzosendenkmal; Französischer Garnisonsfriedhof, 1925, Obelisk, umgeben von schlichten Grabsteinen; Deutscher Ehrenhof mit 1928 eingeweihter Gedächtnishalle, Entwurf Adolf Gelius, Skulptur von Hugo Lederer, Berlin"
"Denkmalzone Jägerstraße 24/26, Neumannstraße 19–23 (ungerade Nummern)", Mainz-Oberstadt,"Wohnhaussiedlung für die französische Besatzung in neubarock-klasizierenden Formen, Zweispänner mit ausgebauten Mansardwalmdächern, 1923–25 von Ludwig Becker und Anton Falkowski"
Denkmalzone Jüdischer Friedhof (Untere Zahlbacher Straße), Mainz-Oberstadt,"1881 eröffnet im direkten Anschluss an den Hauptfriedhof; Trauerhalle, eingeschossiger Backsteinbau in orientalisierenden Formen, 1880/81, Architekt Eduard Kreyßig; einfache Grabsteine mit Inschrift, klassizistische Grabmäler, zum Beispiel: Feld 1 Grabstätte Eheleute Hecht (1881/1888), Postamente mit verhüllten Urnen; Grabstätte Eheleute Oppenheim (1884), Obelisken; Feld 2 H. Meyer, Urne unter Baldachin, Umzäunung, 1890; Feld 3 B. Wolf, aufgesockelter, rosenumwundener Säulenstumpf, 1894; Grabstätte M. M. Mayer (1917), Ädikula; Feld 5 Grabstätte Eheleute Mayer (1903/1916), Ädikulen; Grabstätten Oppenheim (1902/1907), Ädikulen; Feld 7 M. Loeb (1924) und B. Simon (1926), neusachlich"
"Denkmalzone Kartaus (Kartaus 1/3, 5/7, 9/11 und 13/15, Göttelmannstraße 46/48, 50/52 und 54)", Mainz-Oberstadt,"Wohnhofsiedlung, Villenkomplex im Landhausstil, 1911/12 von der „Reichskommission für die Mainz-Kasteler Festungsgrundstücke“, Architekt Paul Kubo"
Denkmalzone Kästrich 13/15–47 (ungerade Nummern), Mainz-Oberstadt,"nach der Pulverturmexplosion 1857 neu entstandene Häuserzeile des älteren Kästrich, der Westseite der Straße, die den im Nordwesten gelegenen Alexanderturm als Blickpunkt miteinbezieht; traufständige, meist zweigeschossige kleine Häuser mit rückwärtigen Lichthöfen zur mittelalterlichen Stadtmauer; Nr.41, 41a, 45, 45a: Blankziegelhäuser mit Zwerchhäusern nach Plänen des Stadtbaumeisters Joseph Laské"
Denkmalzone Krankenhaus (Langenbeckstraße 1), Mainz-Oberstadt,"ehemaliges städtisches Allgemeines Krankenhaus (heute Universitätskliniken); im so genannten Pavillonsystem 1911–14 von Adolf Gelius erbaute achsensymmetrisch ausgerichtete Anlage aus drei, durch Korridore verbundene Gebäudereihen; Patientenhäuser, zweigeschossige Putzbauten; langgestreckte Krankenbauten mit zweieinhalbgeschossigen Mittelpavillons und Seitenrisaliten; zentrale Gartenanlage mit Brunnenschale; Gebäude 1: Hauptgebäude, Dreiflügelanlage auf H-förmigem Grundriss, Mansarddach, teilweise bauzeitliche Einfriedung; Gebäude 2: in den 1920er Jahren L-förmig erweitertes Schwesternhaus mit Mansarddach, an der Nordseite katholische St.-Rochus-Kapelle; Gebäude 3: elfachsiges Krankengebäude mit Mansarddach; Gebäude 4, 5, 10, 11: durch verglaste Wandelgänge verbundene gleichartige Krankengebäude, Mittel- und Eckrisalite; Gebäude 6: Badehaus; Gebäude 7: Operationshaus, zweigeschossiger Teil mit Walmdach, eingeschossiger Gartenteil mit Mansarddach; Gebäude 8: ehemaliges Haus für Lungenkranke, Walmdachbau mit Wintergarten; Gebäude 9: Gebäude für Infektionskranke, zweigeschossiger Mittelteil, eingeschossige Seiten, zwei Rundtürme mit Kegeldach; Gebäude 12: ehemaliges Kinderhaus mit Eingangsrisalit; Gebäude 13: eingeschossig; Gebäude 14: ehemaliges Haus für geschlechtskranke Frauen, Walmdachbau; Gebäude 15: Rest des ehemaligen Hauses für psychisch Kranke; Gebäude 16: Kesselhaus, symmetrisch zusammengestellte ein- und zweigeschossige Teilbauten"
Denkmalzone Kupferbergterrasse, Mainz-Oberstadt,"Aussichtspromenade auf dem über dem Kästrich gelegenen Plateau, 19. Jahrhundert, von Baumreihen durchmessen"
"Denkmalzone Lanzelhohl 96, 98 und 100", Mainz-Oberstadt,"Häusergruppe am Anfang des Weges nach Bretzenheim (Nr. 100 ehemalige Hofanlage mit zwei Putzbauten, Anfang des 19. Jahrhunderts; Nr. 98 Fachwerkhaus, 1825 aufgestockt; Nr. 96 eingeschossiger Putzbau), östliche Begrenzung der Grundstücke Nr. 96 und 98 durch starke Mauer, möglicherweise ein ehemaliger Hochwasserschutz gegen den Zeybach"
"Denkmalzone Neumannstraße 3, 5, 7", Mainz-Oberstadt,"drei dreigeschossige Flachdachbauten im Bauhausstil, 1932, Architekt Carl Hermann Schieker"
Denkmalzone Römersteine, Mainz-Oberstadt,"Rest eines römischen Aquädukts, etwa 60 Gusskerne der ehemaligen Brückenpfeiler, spätes 1. Jahrhundert nach Christus"
"Denkmalzone Siedlung am Fichteplatz (Fichteplatz 1–11 (ungerade Nummern), An der Philippsschanze 2–24 (gerade Nummern) und 19, Nikolaus-Becker-Straße 1–9 (ungerade Nummern) und 2–10 (gerade Nummern), Obere Zahlbacher Straße 42–46 (gerade Nummern) und 52–70 (gerade Nummern), Pariser Straße 25–41 (ungerade Nummern), Schneckenburger Straße 1–15 (ungerade Nummern) und 2–14 (gerade Nummern))", Mainz-Oberstadt,"einheitliche Wohnanlage aus etwas 1000 Wohnungen, 1925–28 vom Städtische Hochbauamt unter Fritz Luft errichtet, Gestaltung und Ausführung verschiedene Mainzer Architekten; auf trapezförmigem Terrain vier geöffnete, in einzelne Hausgruppen unterteilte und Grünflächen einschließende Blöcke, Biberschwanzwalmdächer, Erker, Balkone, Giebelgauben, Schmuckformen in Steinguss, Formen des Heimatstils und des Expressionismus; beispielhaft werden erfüllt die zeitgenössischen Forderungen nach Luft, Sonne und moderner Ausstattung; nach Größe, Konzeption und Erhaltungszustand eine der bedeutendsten Siedlungen des Landes, städtebaulich bedeutsam"
Denkmalzone Stadtpark (An der Favorite/Abtsgasse), Mainz-Oberstadt,"„Neue Anlage“, nach 1820 von Gartenbauer Peter Wolf, im Kern älter; Fachwerkhaus mit Klinkergefachen, 19. Jahrhundert; barocke Herkules-Statue; barocker Rhenus-Torso von Johann Wolfgang Fröhlicher; Marmorbüste Peter Wolf († 1832), Brunnenfigur des ehemaligen Tritonbrunnens, 1862 von Heinrich Barth, Mainz; moderne Plastiken; sechs kreisförmig angeordnete Pappeln, Anfang des 19. Jahrhunderts; Denkmal zur „Erinnerung an das XI. deutsche Bundesschiessen Mainz 1894“ von Konrad Sutter, Ausführung Eduard Hermann Schmahl"
Denkmalzone Thomannstraße 6/8 und Hechtsheimer Straße 109, Mainz-Oberstadt,"kleine Gruppe von Beamtenwohnhäusern, zweigeschossige Putzbauten mit Loggien und verschieferten Walmdächern, 1925/26 vom Volksstaat Hessen errichtet durch Architekt Luley, Hochbauamt Mainz"
"Denkmalzone Trajanstraße 1–11 (ungerade Nummern), Augustusstraße 2 und 4, Germanikusstraße 4/6", Mainz-Oberstadt,"Wohnsiedlung auf dreieckiger Grundfläche; Walmdachbauten in unterschiedlich großen Blöcken, zur Trajanstraße hin schlossartig gruppiert, Heimatstil- und expressionistische Motive, mit umfriedeten Vorgärten und begrüntem Innenhof, 1924/25 von Fritz Luft, Hochbauamt Mainz"
Denkmalzone Zitadelle (Zitadellenweg 1), Mainz-Oberstadt,"regelmäßige Rechteckanlage mit vier Eckbastionen, Graben und Contrescarpe, Kalkstein- und Sandsteinmauerwerk, ab 1655, Bastionen Germanicus und Alarm 1659 vollendet, Bastionen und Kurtinen Drusus und Tacitus 1661 vollendet; rheinseitige Toranlage der Haupttraverse, bezeichnet 1660, Architekt Antonio Petrini; dreiflügeliger Kommandantenbau, 1696 begonnen, 1833 erhöht, nach Kriegszerstörung 1950 in ursprünglicher Form als zweigeschossiger Mansarddachbau wiederhergestellt; Koppelkompaniekaserne, 1914; Citadellkaserne, 1861; Kasino- und Küchenbau (neubarock)"
Am Gautor 15, Mainz-Oberstadt,"viergeschossiges neubarock/neuklassizistisches Eckwohnhaus, 1914, Architekt Peter Crochet"
"Am Klostergarten 1, Am Stiftswingert 5", Mainz-Oberstadt,"Doppelhaus, zehnachsiger neuklassizistischer Eckbau, 1920, Architekt Reinhold Weisse"
Am Klostergarten 3, Mainz-Oberstadt,"Walmdachbau, klassizistische Motive, 1920, Architekt Reinhold Weisse"
Am Klostergarten 5/7 und 9/11, Mainz-Oberstadt,"zwei achtachsige Doppelwohnhäuser mit Standerkern, 1920, Architekt Franz Plaul"
"Am Klostergarten 15, Am Rosengarten 23", Mainz-Oberstadt,"Doppelwohnhaus, Nr. 15 mit eingeschossigen Vorbauten, Nr. 23 mit Eingangsvorbau mit Pultdach, 1920, Architekt Georg Bayer"
Am Linsenberg/Ecke Langenbeckstraße, Mainz-Oberstadt,"Fort Joseph, zwischen 1713 und 1724 angelegt, an der Westseite Kriegerdenkmal 1914/1918, Otto Schneider, Mainz"
Am Pulverturm 13, Mainz-Oberstadt,"ehemalige Kunst- und Gewerbeschule und gewerbliche Berufsschule, heute Universitätsgebäude für den medizinischen Fachbereich; viergeschossige durchfensterte Vierflügelanlage mit Flachdach, der Südflügel sechsgeschossig, 1929–33, Architekt Hermann Graf"
Am Römerlager 25–31 (ungerade Nummern), Mainz-Oberstadt,"Nr. 25–29 Trakt aus drei Wohnhäusern, Nr. 31 Doppelwohnhaus, zweigeschossige sandsteingeglieder Putzbauten mit dreigeschossigen Mittelachsen und Zwerchhaus, 1924 nach Plänen des städtischen Hochbauamtes"
Am Rosengarten 1, Mainz-Oberstadt,"repräsentative Villa im Landhausstil, Putzbau mit abgewalmtem Mansarddach, Gartenpavillon, 1911, Architekt Franz Plaul"
Am Rosengarten 2, Mainz-Oberstadt,"nachklassizistische Villa, Kubus mit Zeltdach, Einfriedung mit zwei Eckpavillons, 1910, Architekt Reinhold Weisse"
Am Rosengarten 4, Mainz-Oberstadt,"Jugendstil-Villa, kunststeingegliederter kubischer Putzbau, 1912, Architekten Jacob Krug und Georg Finke, Darmstadt"
Am Rosengarten 5, Mainz-Oberstadt,"Putzbau mit Sandsteinvorbau und Mansardwalmdach, 1912, Architekten Franz Plaul"
(an) Am Rosengarten 7, Mainz-Oberstadt,"Säulenaltan am veränderten Wohnhaus, 1920, Architekt Franz Gill"
Am Rosengarten 12/14, Mainz-Oberstadt,"Doppelhaus mit Zwerchhäusern, für französische Offiziersfamilien, 1920, Architekten Ludwig Becker und Anton Falkowski"
Am Rosengarten 21, Mainz-Oberstadt,"Eckhaus mit Giebelrisalit und Balkon, 1920 von Georg Bayer"
Am Rosengarten 25, Mainz-Oberstadt,"ein Einzel- und zwei Doppelwohnhäuser mit aufwändigen Portaleinfassungen und Säulenaltanen, 1920 von Adam J. Freitag"
Am Stiftswingert 3, Mainz-Oberstadt,"Putzbau, teilweise lisenengegliedert, 1920 von Reinhold Weisse"
Am Wildgraben 29, Mainz-Oberstadt,"Schule mit ehemaligem Lehrerwohnhaus; Lehrerwohnhaus mit Kniestock, teilweise Zierfachwerk, 1899/1900"
Am Wildgraben 33, Mainz-Oberstadt,"barockes Wohnhaus, teilweise Zierfachwerk, erste Hälfte des 18. Jahrhunderts"
An der Favorite 2, Mainz-Oberstadt,"fünfachsiger Walmdachbau mit einschwingender Fassade, 1922"
An der Favorite 4, Mainz-Oberstadt,"Walmdachbau mit Giebelrisaliten und Loggien, bezeichnet 1922"
An der Goldgrube 44, Mainz-Oberstadt,"Katholische St. Albanskirche; sechsachsiger Rechtecksaal mit Turm, 1951/52, Architekt Franz Mertes"
An der Karlsschanze 7, Mainz-Oberstadt,"Villa im Landhausstil, Putzbau, teilweise Fachwerk, 1911, Architekt Th. Ferber, Berlin; Garagenanbau in analogen Formen, 1914, Architekten Jacob Krug und Georg Finke, Darmstadt"
An der Karlsschanze 10, Mainz-Oberstadt,"Jugendstil-Villa, Putzbau, teilweise Zierfachwerk (verputzt), 1911, Architekt Jacob Krug, Darmstadt"
An der Karlsschanze 12, Mainz-Oberstadt,"kubischer Putzbau mit Mansarddach, 1908/09 von Georg Bayer"
(an) An der Karlsschanze 16, Mainz-Oberstadt,"Portalzone, Hauptportal und Personaleingang, Jugendstil, am nach Kriegseinwirkungen vereinfacht und verändert wiederaufgebauten Wohnhaus, 1909, Architekt Jacob Krug, Darmstadt"
Auf dem Albansberg 1, Mainz-Oberstadt,"kleine Villa im Landhausstil mit Pseudo-Mansarddach, 1909, Architekt Adam J. Freitag, Veranda 1949"
(an) Auf dem Albansberg 16, Mainz-Oberstadt,"Hauszeichen, barockes Rotsandsteinrelief, bezeichnet 1707"
Auf der Bastei 1 und 3, Mainz-Oberstadt,"ehemalige Villen Behnke; anspruchsvolle, durch Laufgang verbundene neubarocke Zwillingsvillen, bezeichnet 1913/14, Architekt Paul Kubo, Nr. 3 mit ursprünglichem Mansarddach"
Auf der Bastei 2, Mainz-Oberstadt,"ehemalige Villa Jung; zweieinhalbgeschossige Villa in strengen Formen, kunststeingegliederter Putzbau mit Portalvorbau, 1913, Architekt Professor Albin Müller, Darmstadt"
(bei) Auf der Steig 2a, Mainz-Oberstadt,"Kartusche, bezeichnet 1702"
Auf der Steig 10, Mainz-Oberstadt,"villenartiger Zeltdachbau, teilweise Fachwerk, 1909/10, Architekt Paul Kubo"
Auf der Steig 12/14, Mainz-Oberstadt,"unterschiedlich gegliedertes Doppelhaus mit Krüppelwalm- bzw. Fußwalmdach, 1909, Architekt Paul Kubo"
(bei) Auf der Steig 16, Mainz-Oberstadt,"Gedenkstein für die im Ersten Weltkrieg eingesetzten Schwestern des ehemaligen Alice-Krankenhauses, Kunststeinrelief, 1920er Jahre"
Augustusstraße, Mainz-Oberstadt,"Bastion Alexander, um 1660; aus Sand- und Kalksteinblöcken, Mauerreste der neupreußischen Polygonalbefestigung, 1876 ff."
Augustusstraße, Mainz-Oberstadt,"Alexanderturm; wahrscheinlich auf römischen Fundamenten, aufgehendes mittelalterliches Bruchsteinmauerwerk, kuppelgewölbtes Untergeschoss mit rundbogigem Eingang aus Rotsandstein, 1500, Turmhelm neu, nördlicher Ansatzpunkt des mittelalterlichen Mauerrings erkennbar"
"Augustusstraße 1/3, Römerlager 28", Mainz-Oberstadt,"Beamtenwohnhaus; zwei im Winkel zusammengestellte Baukörper mit hohem Mansardwalmdach, eingestellter Treppenturm, expressionistische Einzelformen, bezeichnet 1928, Architekt Benz, Hessisches Hochbauamt"
"Augustusstraße 2, 4", Mainz-Oberstadt,"zwei gleichartige Doppelhäuser mit Walmdächern, 1924/25 von Fritz Luft"
Backhaushohl 4, Mainz-Oberstadt,"Katholische Pfarrkirche St. Achatius; Saalbau, 1809/10, Architekt François-Auguste Cheussey; Kreuzigungsgruppe 1908, Kriegerdenkmal 1922, Grabsteine frühes 19. Jahrhundert"
Bastion Martin, Mainz-Oberstadt,"Bastion Martin; Teil des 1655 begonnenen Bastionsgürtels, nur noch Mauerreste erhalten"
Bretzenheimer Straße ohne Nummer, Mainz-Oberstadt,"Brunnenanlage, kubischer Rotsandsteinquaderbau, erste Hälfte des 19. Jahrhunderts"
Bretzenheimer Straße 25, Mainz-Oberstadt,"barocker Krüppelwalmdachbau, 18. Jahrhundert"
Drususstraße 6, Mainz-Oberstadt,"dreigeschossiges Eckhaus, 1866, Architekt wohl Wilhelm Usinger"
Drususstraße 12, Mainz-Oberstadt,"anspruchsvolles dreigeschossiges Zeilenwohnhaus, 1866, Architekt wohl Wilhelm Usinger"
Drususstraße 16, Mainz-Oberstadt,"dreigeschossiges Zeilenwohnhaus, 1882, Architekt Carl Strebel"
Drususwall 48, Mainz-Oberstadt,"villenartiger Putzbau im Landhausstil, 1911, Architekt Jacob Secker"
Drususwall 52, Mainz-Oberstadt,"Hälfte einer Doppelvilla im Landhausstil, 1911, Architekt Jacob Secker"
Germanikusstraße 14/16, Mainz-Oberstadt,"Doppelhaus mit Walmdach, expressionistische Motive, 1924/25 von Fritz Luft"
"Göttelmannstraße 48, 50/52 und 54", Mainz-Oberstadt,"Walmdachbauten in reichem Landhausstil, 1911/12 von Paul Kubo"
Hechtsheimer Straße 62, Mainz-Oberstadt,"Villa in schlichtem Landhausstil, 1911/12, Architekt Franz Plaul"
Hechtsheimer Straße 64–76 (gerade Nummern), Mainz-Oberstadt,"Wohnhausbauten für französische Offiziere; Nrn. 64–68 und 72–76 dreiflügelige Anlagen mit Nr. 70 als Mittelpunkt, 1920 von Ludwig Becker und Anton Falkowski"
Hechtsheimer Straße 105, Mainz-Oberstadt,"dreigeschossiger Flachdachbau im Bauhausstil, 1929, Architekt Christian Musel"
Hechtsheimer Straße 107, Mainz-Oberstadt,"Villa, Ziegelbau mit Walmdach, 1929, Architekt Peter Gustav Rühl"
Hechtsheimer Straße 109, Mainz-Oberstadt,"Beamtenwohnhaus, kubischer Walmdachbau, 1925, Architekt Philipp Luley"
Heinrich-von-Gagern-Straße, Mainz-Oberstadt,"Denkmal der Siedlungsgemeinschaft des Ketteler-Bauvereins für die Toten des Zweiten Weltkriegs, Pfeiler mit Bronzetondo (Reliefbüste des Mainzer Bischofs von Ketteler), Umfassungsmauer und Eisengitter, nach 1924"
Jägerstraße 24/26, Mainz-Oberstadt,"Doppelwohnhaus mit dreigeschossigen Mittelrisaliten, 1923–25 von Ludwig Becker und Anton Falkowski"
Jägerstraße 27, Mainz-Oberstadt,"Reste der Einfriedung der ehemaligen Kaserne des Fuß-Artillerie-Regiments Nr. 3, um 1910"
Jägerstraße 33, Mainz-Oberstadt,"ehemaliges Kasernengebäude; viergeschossige Dreiflügelanlage, Neurenaissance, stattliche Umfriedung, um 1910"
Johann-Joachim-Becher-Weg, Mainz-Oberstadt,"Fort Bingen; Überreste, bestehend aus einem Abschnitt der Kapitalpoterne und unterer Ebene eines Flankenkasemattenkorps, 1863–66 von Gustav Treumann mit Beteiligung von Frosch und Götze"
Kartaus 1/3, Mainz-Oberstadt,"Doppelhaus mit abgewalmtem Mansarddach, 1911/12, Architekt Paul Kubo"
Kartaus 5/7, Mainz-Oberstadt,"Doppelhaus mit abgewalmtem Mansarddach, 1911/12, Architekt Paul Kubo"
Kartaus 9/11, Mainz-Oberstadt,"Doppelhaus mit abgewalmtem Mansarddach, Risalite mit Giebelmansarddach, 1911/12, Architekt Paul Kubo"
Kartaus 13/15, Mainz-Oberstadt,"Doppelhaus, Krüppelwalmdachbau mit gleich hohen Querbauten, 1911/12, Architekt Paul Kubo"
Kästrich 1, Mainz-Oberstadt,"Haus Zum Fuchs; neubarockes Beamtenwohnhaus, dreigeschossiger Mansarddachbau mit zwei Schauseiten, 1907/08, Architekten Kurt Röhrich und Paul Kubo, unter Verwendung barocker Architekturteile"
"Kästrich 2, 2a, 2b", Mainz-Oberstadt,"Dreifachhaus, viergeschossige Rotziegelbauten, 1864, Architekt Christian Lothary"
(an) Kästrich 3, Mainz-Oberstadt,"reliefierter Scheitelstein, 1907/08, zur Erinnerung an die Pulverturmexplosion 1857"
Kästrich 8, Mainz-Oberstadt,Verwaltungsbau der ehemaligen Brauerei Schöfferhof-Dreikönigshof; Klinkerfassade
Kästrich 12, Mainz-Oberstadt,"ehemaliges St. Vinzenz- und Elisabeth-Hospital; heute Wohnhaus, Zweiflügelanlage mit Mittelrisaliten, neugotische Motive, 1868–70, Architekt Joseph Wessicken, Erweiterung 1893/94, Architekt Peter Gustav Rühl, und 1899/1900, Architekt Franz Gill"
"Kästrich 27, 31, 37, 47", Mainz-Oberstadt,auf römischen Fundamenten aufbauende Teile der mittelalterlichen Stadtmauer
(an) Kästrich 37, Mainz-Oberstadt,"Hausmadonna, um 1700"
Kupferbergterrasse 14, Mainz-Oberstadt,"viergeschossiger Neurenaissancebau, 1866, Architekt Conrad Kraus"
Kupferbergterrasse 15, Mainz-Oberstadt,"Alexanderkaserne; Rotsandstein- und Quadermauerwerksbau mit zinnenbekrönten Risaliten und Ecken, 1862/63, Architekt von Tiedemann"
Kupferbergterrasse 16, Mainz-Oberstadt,"dreigeschossiger herrschaftlicher Neurenaissancebau mit barocken und klassizistischen Motiven, 1866, Architekt Conrad Kraus, Bildhauerarbeiten wohl von Heinrich oder Valentin Barth; Ausstattung"
Kupferbergterrasse 17, Mainz-Oberstadt,"langgestreckter dreigeschossiger Massivbau, 1860; rückwärtig Kellerei, sandsteingegliederter Klinkerbau, bezeichnet 1889; im Hof Bacchuskopf; im Zugang zu Nr. 17 barocke Fürglügel, daneben gusseiserne Erinnerungstafel"
