auf dem Berggipfel südlich des Ortes,Balduinstein,"Schloss Schaumburg; dreigeschossiger neugotischer Hauptflügel, Basalt, 1850; Ostflügel mit mittelalterlichen Mauerresten und spätmittelalterlichen Bauteilen; Schlosskapelle, Anfang des 19. Jahrhunderts; dreigeschossiger Fachwerkbau, wohl noch aus dem 18. Jahrhundert, Mitte des 19. Jahrhunderts verkleidet; Torbau, teilweise Fachwerk, 16. bis 17. Jahrhundert, Torbau von 1855; spätgotische Zwinger- und Vorburgmauern, Flankenturm; ehemaliges Verwaltungs- und Remisengebäude, dreigeschossige hufeisenförmige Anlage, zweite Viertel des 18. Jahrhunderts; ehemaliger Wirtschaftshof, 1778",50.343868,7.973788
auf dem Friedhof östlich des Ortes,Balduinstein,"Grabdenkmal, Kreuzigungsgruppe, zweite Hälfte des 18. Jahrhunderts; einige Grabkreuze vom späten 16. bis ins 18. Jahrhundert",48.285616,9.734037
Am Schwalbenstein 15,Balduinstein,"Haus Schwalbenstein; ehemalige Gärtnerinnenschule; zwei- bis dreigeschossiger villenartiger Bau, teilweis mit Zierfachwerk, um 1900/10",50.346989,7.974111
(neben) Am Schwalbenstein 15,Balduinstein,"Wegekapelle; verputzter und verschieferter Fachwerkbau, 18. oder 19. Jahrhundert",50.346989,7.974111
Hausen 6,Balduinstein,"Gutshof; Walmdachbau, dreiflügelige Wirtschaftsgebäude, Gartenhaus",50.348817,7.972162
"nördlich von Hausen, am Waldrand gelegen",Balduinstein,Jüdischer Friedhof; eingezäuntes Gelände mit etwa zehn Grabsteinen,52.866262,14.057547
Wikipedia,Balduinstein,ilderwunsch an bestimmtem Ort,50.343868,7.973788
