Denkmalzone Jüdischer Friedhof (nördlich der Ortslage am Weg nach Kaltenholzhausen),Burgschwalbach,Wiesengelände mit zahlreichen Grabsteinen,50.283837,8.077956
Bachstraße 15,Burgschwalbach,ehemalige Fachwerkscheune,50.283325,8.079403
"Gartenstraße 1, Panröder Straße 2",Burgschwalbach,"Fachwerkhaus, teilweise massiv, 17. Jahrhundert",50.28298,8.080678
Kettenbacher Straße 2,Burgschwalbach,"Wohnhaus einer Hofanlage, teilweise verputzt und verbrettert, Fachwerk um 1700",50.283267,8.078334
Kirchstraße 2,Burgschwalbach,Evangelische Pfarrkirche St. Johannes; kleiner romanischer Saalbau,50.2842,8.078567
Kirchstraße 5,Burgschwalbach,"Fachwerkhaus, teilweise massiv, spätes 17. Jahrhundert",50.283849,8.079493
Kirchstraße 10,Burgschwalbach,"Fachwerkhaus, verputzt und verschiefert, wohl aus dem 17. oder 18. Jahrhundert, um Kniestock erhöht",50.283659,8.079537
Kirchweg 3,Burgschwalbach,"verputztes Fachwerkhaus, wohl aus dem 17. oder 18. Jahrhundert",50.283739,8.080032
Schloßstraße 8,Burgschwalbach,"ehemalige Schule; Walmdachbau, verputzt und verschiefert, Reformarchitektur, um 1910",50.284407,8.079034
