Oberstraße 2,Dörscheid,"Evangelische Pfarrkirche; zweiachsiger Saalbau, erste Hälfte des 14. Jahrhunderts, Rundbogenfenster von 1668, oberer Teil des Turms aus dem 19. Jahrhundert",50.1056,7.759324
Oberstraße 34/36,Dörscheid,"Streckhof, verputzt und verschiefert; Krüppelwalmdachbau, Fachwerk wohl aus dem 17. oder 18. Jahrhundert, risalitartiger Eingangsvorbau aus der ersten Hälfte des 20. Jahrhunderts, Stallscheune",50.106437,7.754267
Unterstraße 10,Dörscheid,"Fachwerkhaus, teilweise massiv, verputzt und verschiefert, 18. Jahrhundert; Fachwerkscheune, teilweise massiv, 18. Jahrhundert",50.105848,7.759279
Unterstraße 18,Dörscheid,"verputztes Fachwerkhaus, wohl aus dem 18. Jahrhundert",50.105906,7.757932
Unterstraße 35,Dörscheid,"Fachwerkhaus, teilweise massiv, verputzt, wohl aus dem 17. oder 18. Jahrhundert",50.106957,7.754267
nordwestlich der Ortslage am Urbach,Dörscheid,"Urbachsmühle; Fachwerkhaus, teilweise massiv, 17. oder 18. Jahrhundert","",""
westlich der Ortslage auf einer steil zum Rhein hin abfallende Felsnase,Dörscheid,"ehemalige Burg Herzogenstein (Rineck); Fragmente eines nahezu quadratischen Baus und eines Turms der eventuell 1359/60 errichteten, wohl bereits 1361 zerstörten Burg",50.10523,7.757536
