Bergstraße 1,Eppenrod,"Fachwerkhaus, teilweise massiv und verkleidet, 18. Jahrhundert",50.403007,7.928378
Bornstraße 2,Eppenrod,"Fachwerkhaus, 18. Jahrhundert",50.404006,7.929483
Hauptstraße 1,Eppenrod,"Hofanlage; Fachwerkhaus, 18. Jahrhundert, Fachwerkscheune, teilweise massiv, erste Hälfte des 19. Jahrhunderts",50.403397,7.930229
Heistenbacher Straße 6,Eppenrod,"verputztes Fachwerkhaus, wohl aus dem 17. oder 18. Jahrhundert",50.403259,7.931414
Isselbacher Straße 4,Eppenrod,"Pfarrhaus; stattliches Wohnhaus, teilweise massiv und verschiefert, Zierfachwerk eventuell noch aus der zweiten Hälfte des 17. Jahrhunderts, direkt östlich der Kirche gelegen",50.405567,7.929815
Ober der Kirch 2,Eppenrod,"Evangelische Pfarrkirche St. Andreas; romanischer Westturm, spätromanisches Chorjoch, Schiff aus dem 18. Jahrhundert",50.405757,7.928342
