"Düngenheimerstraße, Ecke Hambucher Straße",Eulgem,"Kapelle, Pietà; Missionskreuz, bezeichnet 1760","",""
Hauptstraße 15,Eulgem,"Katholische Filialkirche St. Anna; Saalbau, Backstein, 1900/01, Architekt Lambert von Fisenne, Gelsenkirchen",50.239185,7.175033
(vor) Hauptstraße 15,Eulgem,"Brunnen; Basalt, bezeichnet 1858",50.239185,7.175033
"Sängerweg, Ecke Hauptstraße",Eulgem,"Wegekreuz, Fragment, 1624",50.239277,7.173236
an der K 21 Richtung Hambuch,Eulgem,"Heiligenhäuschen, teilweise Fachwerk; Kreuz, bezeichnet 1830",49.160943,11.261586
nördlich von Eulgem an der Straße nach Düngenheim,Eulgem,"Wegekreuz, bezeichnet 1727","",""
nördlich von Eulgem an der Straße nach Düngenheim,Eulgem,"Wegekreuz, 18. Jahrhundert","",""
