Auf der Venn 2,Mittelstrimmig,"Quereinhaus; Fachwerkbau, teilweise massiv, 18. Jahrhundert","",""
Schulstraße,Mittelstrimmig,"Katholische Kirche St. Philippus und Jakobus; dreischiffige barocke Halle, 1766–69, Architekt wohl Paul Stähling, Straßburg, Chorerweiterung 1959–62; zwei Grabplatten, eine spätgotisch, 1522, offensichtlich 1729 zweitverwendet; zwei Grabkreuze, 1811, 1819; Gesamtanlage mit umgebenden Areal",50.091119,7.284753
Schulstraße 11/13,Mittelstrimmig,"Fachwerkhaus, Nr. 11 verputzt, Nr. 13 teilweise verschiefert, abgewalmtes Mansarddach, 18. Jahrhundert",50.091096,7.283415
an der Hannosiusmühle südlich des Ortes im Mittelstrimmiger Wald,Mittelstrimmig,"Kapelle, Saalbau mit Dachreiter, 19. Jahrhundert",52.468478,13.515261
an der K 43 Richtung Liesenich,Mittelstrimmig,"Wegekapelle, innen: barocker Kruzifix, wohl aus dem 18. oder 19. Jahrhundert",49.160943,11.261586
nordwestlich des Ortes,Mittelstrimmig,"Wegekreuz, Gusseisen, 19. Jahrhundert",50.089119,7.283145
