Unterdorf 1,Hellertshausen,"Streuhof; stattliches Wohnhaus, teilweise verschiefert, 1842, Backes bezeichnet 1834, stattliche Ökonomie, wohl 1842",49.82045,7.277414
(gegenüber) Unterdorf 7,Hellertshausen,"Backhaus; Satteldachbau, Mitte des 19. Jahrhunderts",49.82063,7.278016
Hammerbirkenfeld,Hellertshausen,"ehemaliges Herrenhaus der Familie von Stumm; barockes Quereinhaus, teilweise Fachwerk (verputzt), bezeichnet 1772",49.811969,7.240304
Mombach,Hellertshausen,"ehemalige Mühle; Fachwerkbau auf massivem Sockelgeschoss, Giebeltrapez verschiefert, Krüppelwalmdach, wohl noch aus dem 18. Jahrhundert",49.813963,7.242092
Mombach 1,Hellertshausen,"Stallgebäude, Sandsteintürrahmen, bezeichnet 1742",49.814195,7.241975
nordwestlich des Ortes im Vierherrenwald,Hellertshausen,"Haniels Schlösschen; späthistoristische Jagdvilla, Kreuzgiebeldach, um 1900",49.820798,7.273955
