Denkmalzone Jüdischer Friedhof (südöstlich des Ortes),Hottenbach,38 Grabsteine unterschiedlicher Formensprache,49.825128,7.300177
Hauptstraße,Hottenbach,"Evangelische Pfarrkirche; ehemaliger Chorturm, wohl aus der zweiten Hälfte des 13. Jahrhunderts, Pyramidendach eventuell aus dem 16. Jahrhundert; achteckiger Bruchsteinbau mit Zeltdach, Anbauten kreuzförmig angeordnet, bezeichnet 1904, Architekt August Senz, Düsseldorf; Schutzdach um 1700; Ausstattung des Vorgängers; drei Glocken: 13. Jahrhundert, 1595, 1628; römischer Viergötterstein; ortsbildprägend",47.540529,8.824735
"Ringstraße, auf dem Friedhof",Hottenbach,"Kriegerdenkmal, reliefierter Sockel, Soldatenskulptur, 1920er Jahre von F. Ritter und Nachfahren",49.826534,7.298183
Ringstraße 4,Hottenbach,"Wohnhaus, 19. und 20. Jahrhundert, Zierfachwerk, Anfang des 18. Jahrhunderts",49.823884,7.299423
Ringstraße 20,Hottenbach,"Wohnhaus, Zierfachwerk bezeichnet 1710",49.825448,7.300195
Ringstraße 53,Hottenbach,"sogenannter Oberhof; Wohn- und Verwaltungsbau mit Mansarddach, bezeichnet 1792; Ausstattung",49.824128,7.29759
Schulstraße 6,Hottenbach,"ehemaliges Schulhaus; Walmdachbau, teilweise verschiefert, bezeichnet 1928, Architekt Nicolaus Coenen, Bernkastel",49.823629,7.300078
Hottenbacher Mühle 12,Hottenbach,"Gerhardsmühle oder Hottenbacher Mühle; Fachwerkbau, Ende des 19. Jahrhunderts",49.837441,7.281771
