Denkmalzone Kaisergarten (Hauptstraße),Stipshausen,"kreisförmige Pflanzung von acht Linden, anlässlich der Reichsgründung nach 1871 gepflanzt, eine der letzten Anlagen ihrer Art",49.848839,7.291742
Denkmalzone Jüdischer Friedhof (Wiesenstraße),Stipshausen,"in der zweiten Hälfte des 19. Jahrhunderts angelegt; 17 Grabsteine in situ, 1868 bis 1940",49.848839,7.291742
Hauptstraße 24,Stipshausen,"Streckhof, teilweise Fachwerk, teilweise verschiefert, wohl aus der ersten Hälfte des 19. Jahrhunderts",49.847259,7.290502
Hauptstraße 25,Stipshausen,"breitgiebeliges Wohnhaus, im Kern vor 1800",49.8482,7.290547
Hauptstraße 38,Stipshausen,"Evangelische Pfarrkirche; Saalbau mit stattlichem Dachreiter, 1772–79, Architekt eventuell Johann Thomas Petri, Kirn; Ausstattung; Stumm-Orgel von 1861 (Prospekt neu); Glocke 1492",49.848548,7.291625
Schulstraße 3,Stipshausen,"ehemalige katholische Schule; asymmetrischer Krüppelwalmdachbau, um 1900",49.847416,7.289316
Zum Idar 2,Stipshausen,"kleiner Streckhof, spätes 19. Jahrhundert; straßenbildprägend",49.850059,7.290727
Gerwertsmühle 1,Stipshausen,"Gerwertsmühle; kleines Mühlengebäude, bezeichnet 1815; technische Ausstattung, Müllerwohnung, Werkstatt, Stallungen im Kellergeschoss","",""
südlich des Ortes am Kappelbach,Stipshausen,"Stipshausener Mühle; stattlicher Krüppelwalmdachbau, teilweise Fachwerk, 18. Jahrhundert",51.9335,12.225388
