Burgweg 6,Albessen,"eingeschossiger sandsteingegliederter Putzbau über hohem Keller, 1909, Architekt Adam Schneider, Konken",49.516998,7.331259
In der Alb 5,Albessen,"Dreiseithof; stattlicher Krüppelwalmdachbau, zwei Stallscheunen, 1906/07, Architekt Christoph Berndt, Kusel",49.517478,7.33293
Bahnhofstraße 2,Altenglan,"spätbarockes Wohnhaus, bezeichnet 1785; langgestreckter Krüppelwalmdachbau; ortsbildprägend",49.556636,7.464003
Eisenbahnstraße 3,Altenglan,"Bahnhof; großvolumiges Empfangsgebäude, eingeschossiger Güterschuppen mit Laderampe, 1862/68",49.548097,7.461613
Eisenbahnstraße 8/10,Altenglan,"Leitungsbezirks- und Wohngebäude der Post; zweigeschossige Flügelbauten, eingeschossiger Garagentrakt, 1925, Architekten Heinrich Müller und Mitarbeiter",49.548097,7.461613
Friedelhauser Straße 11,Altenglan,"ehemaliges Verwaltungsgebäude der Basalt Aktiengesellschaft, Linz am Rhein; neubarocker Walmdachbau, 1921/22, Architekten Heinrich Mattar und Eduard Scheler, Köln; rückwärtig Remisen- und Stallgebäude",49.554327,7.467057
Glanstraße 30,Altenglan,"ehemaliges Rathaus; sandsteingegliederter Krüppelwalmdachbau, 1856/57, Umbau 1896; platzbildprägend",49.556636,7.464003
Kuseler Straße 2,Altenglan,"Protestantische Pfarrkirche; barocker Saalbau mit Walmdach, bezeichnet 1720, im Kern älter, Dachreiter 1806; romanisches Skulpturenfragment; durchgreifende Sanierung 1956, Architekt Hans-Georg Fiebiger, Kaiserslautern; auf dem Friedhof: Kriegerdenkmal 1914/18, sterbender Krieger, 1927 von A. Bernd, Kaiserslautern",49.553947,7.460508
Denkmalzone Mühlbacher Mühle (Mühlweg 3),Altenglan,"Gebäudegruppe aus der ehemaligen Getreidemühle; siebenachsiger sandsteingegliederter Putzbau, Erweiterung 1892 und Ölmühle (1858), Scheunenanlage (nach 1845) und der vom Glan abgeleitete Mühlbach",49.549126,7.46147
(bei) Genickelstraße 4,Altenglan,"ehemalige Schmiede; eingeschossiger Fachwerkbau, teilweise massiv, Pultdachanbau, Schleifstein, erste Hälfte des 18. Jahrhunderts","",""
Moorstraße 13,Altenglan,"Protestantische Kirche; Bruchsteinsaal mit Glockenturm, Heimatstil, 1933/34, Architekt Regierungsbaumeister Stahl, Landau",49.543947,7.466392
Streitmühle 1,Altenglan,"ehemalige Seylsche Mühle; spätbarocker sandsteingegliederter Putzbau, zweite Hälfte des 18. Jahrhunderts; Wehranlage; Wirtschaftsgebäude: Remise und Gesindehaus, gegen 1859, Stallscheune und Lagerhaus jünger; einbogige Steinbrücke, 1854, Architekt Johann Schmeisser, Kusel",49.533839,7.456789
südlich des Ortes in der Nähe der Moorstraße,Altenglan,"Laufbrunnen; Brunnenanlage, Sandstein und Gusseisen, 1846, Architekt Karl Klee",49.549126,7.46147
Hauptstraße 24,Altenglan,"sandsteingegliedertes Quereinhaus, 1864",49.556636,7.464003
(bei) Zum Horst 6,Altenglan,"ehemalige Schmiede, Putzbau mit teilweise abgeschlepptem Satteldach, wohl um 1865; technische Ausstattung",49.565249,7.450501
Fockenmühle 2,Altenglan,"Fockenmühle; ehemalige Öl- und Getreidemühle; dreigeschossige Einfirstanlage, im Kern aus dem 18. Jahrhundert, bezeichnet 1864 und 1871 (Umbauten), Aufstockungen 1922 und 1938, Stallscheune 1871; technische Ausstattung aus den 1930er Jahren, unterirdisch herangeführter Mühlgraben und Lauf des Glan ab der zugehörigen Wehranlage",49.568877,7.452352
Bergstraße 1,Altenkirchen (Pfalz),"ehemalige Schule; eingeschossiger Krüppelwalmdachbau, 1782/83; Ausstattung der Grubenverwaltung, 1820",50.761066,7.621666
Breitenbacher Straße 1,Altenkirchen (Pfalz),"Protestantisches Pfarrhaus; aufgesockelter Putzbau, 1861/62",49.442769,7.320048
Breitenbacher Straße 4,Altenkirchen (Pfalz),"Gasthaus, großvolumiger hausteingegliederter Eckbau; ortsbildprägend",49.442869,7.319715
Schillerstraße 38,Altenkirchen (Pfalz),"Protestantische Pfarrkirche; spätromanischer Chorturm, Ende des 13. Jahrhunderts, barocker Saalbau, bezeichnet 1756, und Turmaufstockung mit welscher Haube von 1818",49.44274,7.320407
Schulstraße 12,Altenkirchen (Pfalz),"Grundschule; großvolumiger Walmdachbau, 1914–19, Architekt Bezirksbaumeister Löhmer, Homburg",50.741108,7.668971
"zwischen Altenkirchen und Frohnhofen, an der St. Wendeler Straße bei der Abzweigung nach Krottelbach",Altenkirchen (Pfalz),"Stundenstein, 1838/40","",""
Hauptstraße 14,Aschbach (Westpfalz),"Quereinhaus, 1798",49.281479,8.744309
Pitzerstraße 1,Aschbach (Westpfalz),"Scheune, Fachwerkbau, teilweise massiv, 17. Jahrhundert (?)",49.60027,7.575996
Hauptstraße 6,Bedesbach,"Quereinhaus, 1821, Scheunenanbau nach 1842, Wirtschaftshof mit Brunnen und Walnussbaum; ortsbildprägend",47.539495,8.821717
(bei) Ringstraße 16,Bedesbach,"ehemalige Schmiede; eingeschossiger Putzbau, Schleifstein, Mitte des 19. Jahrhunderts; technische Ausstattung",49.566739,7.456843
Im Röhrbach 10,Blaubach,"Quereinhaus, bezeichnet 1769",49.557968,7.395776
Matzenberg 5,Blaubach,"ehemaliges Schulhaus; sandsteingegliederter Putzbau, 1833/38, Architekt Johann Schmeisser, Kusel, Aufstockung und Dachreiter, 1891/95, Architekt Bezirksbaumeister Mergler, eingeschossiger Anbau 1914",49.55701,7.395785
Hauptstraße 21,Börsborn,"Dreiseithof, 19. Jahrhundert; sandsteingegliedertes Quereinhaus, bezeichnet 1826, Ökonomie 1895, Schweineställe, Dunggrube, Bauerngarten",49.440707,7.399136
(bei) Steinbacher Straße 4,Börsborn,"Glockenturm; Putzbau mit Zeltdach, 1758",49.441029,7.398641
(an) Eckstraße 3,Bosenbach,"reich dekorierter Ofenstein, bezeichnet 1801",49.540416,7.528457
Hauptstraße 5,Bosenbach,"ehemaliges protestantisches Pfarrhaus; sandsteingegliederter Krüppelwalmdachbau, 1830/31, Architekt Heinrich Ernst, Kaiserslautern; Scheune 1820/21",49.540206,7.527092
Hauptstraße 23,Bosenbach,"Protestantische Kirche; nachbarocker Saalbau mit Dachreiter, bezeichnet 1802; Glocken: 1474 von Johann Otto, Kaiserslautern, 1746 von Christoph Klein, Schwarzenacker; Ausstattung",49.539767,7.529068
Hauptstraße,Bosenbach,"Turm der sogenannten Wolfskirche; ehemaliger Ostchorturm, um 1310, Gelbsandstein, Fundament römisches Mauerwerk; Ausmalung um 1330/40, römische Skulpturengruppe",49.539779,7.530281
Im Brühl,Bosenbach,"Alte Brücke; einbogige Bruchsteinbrücke, 1764",49.543088,7.494842
Friedhofstraße 5,Breitenbach (Pfalz),"Protestantische Pfarrkirche; Chorturm aus dem 13. oder 14. Jahrhundert, spätbarocker Saalbau, 1783–87, Architekt Friedrich Gerhard Wahl, Zweibrücken; römische Spolien",50.121376,9.947333
Kirchstraße 12,Breitenbach (Pfalz),"Katholisches Pfarrhaus; Quaderbau mit Giebelrisalit, neugotische Motive, bezeichnet 1899",50.289115,9.821847
Kirchstraße 14,Breitenbach (Pfalz),"Katholische Pfarrkirche St. Jakob; neugotischer Sandsteinquaderbau, Chorflankenturm, 1898–1900/04, Architekt Wilhelm Schulte I., Neustadt an der Weinstraße",50.289305,9.822278
Waldmohrer Straße 13,Breitenbach (Pfalz),"Protestantisches Pfarrhaus; klassizistischer Walmdachbau, bezeichnet 1824",49.432945,7.272249
Bergstraße 2,Brücken (Pfalz),"Quereinhaus, Aufstockung 1841, Stallanlagen aus der zweiten Hälfte des 19. Jahrhunderts",51.495157,9.456017
(bei) Glanstraße 16,Brücken (Pfalz),"Wegekreuz; Postament und Kreuz aus Gelbsandstein, Korpus Gussmetall, 19. Jahrhundert",49.43274,7.362035
Glanstraße 24,Brücken (Pfalz),"Quereinhaus über hohem Keller, 1911; Stuckdecken",49.432599,7.363023
Hauptstraße 26,Brücken (Pfalz),"ehemalige katholische Schule; späthistoristischer Walmdachbau, Giebelrisalit, 1903, Architekt Bezirksbaumeister Löhner, Homburg; straßenbildprägend",52.293278,9.054524
Hauptstraße 66b,Brücken (Pfalz),"Katholische Pfarrkirche St. Laurentius; großvolumiges Hauptschiff mit Walmdach, niedrige Seitenschiffe, Glockenturm, 1953–55, Architekt Wilhelm Schulte II.",48.589816,9.551984
Friedhofstraße 5,Cronenberg (bei Lauterecken),"ehemalige Schule; Putzbau mit Dachreiter, Rundbogenstil, um 1840, Architekt wohl Johann Schmeisser, Kusel",49.653098,7.624298
Friedhofstraße 7,Cronenberg (bei Lauterecken),"kleine Hofanlage, wohl aus dem 18. Jahrhundert; Wohnhaus, teilweise Fachwerk, Stallscheune; Treppenhausanbau 1870",49.653016,7.62464
(bei) Hauptstraße 15,Cronenberg (bei Lauterecken),"römische Säule, Sandstein",51.205532,7.130189
Hauptstraße 29,Dennweiler-Frohnbach,"Protestantische Pfarrkirche; hausartiger sandsteingegliederter Putzbau über Bossenquadersockel, Glockenturm, 1906, Architekt Bauamtsassessor Dünnbier, Kaiserslautern",49.578966,7.386918
(an) Frohnbacher Hof 9,Dennweiler-Frohnbach,"Ofenstein, um 1805","",""
(bei) St. Wendeler Straße 71,Dittweiler,"Kriegerdenkmal, monumentale Soldatenskulptur, 1936, von August Deubzer, Kaiserslautern",59.281639,11.117801
St. Wendeler Straße 73,Dittweiler,"Alte Schmiede („Hiwwelschmidd“); eingeschossiger Ziegelbau, 1872, Umbau 1908; technische Ausstattung von 1920",59.281588,11.117173
Brunnenstraße 14,Dunzweiler,"Protestantische Kirche; gotisierender Quaderbau, oktogonales Turmobergeschoss, 1840/41",49.414569,7.306465
Schulstraße 10,Einöllen,"Protestantische Pfarrkirche; kleiner Saalbau, 1430, Überformung 1729; Stumm-Orgel von 1812/13",49.608729,7.638779
"Denkmalzone Mühle (Mühlweg 10, 21, 23, 25)",Erdesbach,"ehemalige Mühle samt Wehr und zwei bäuerliche Anwesen: Nr. 10 und 21: ehemalige Mühle: Nr. 10, 18. Jh., Nr. 21: Krüppelwalmdachbau, Ende des 19. Jahrhunderts, Nr. 23: Quereinhaus, bezeichnet 1758 und 1806 (Umbau), Nr. 25: Quereinhaus, 1869",49.573118,7.444033
Zweibrücker Straße 32,Erdesbach,"ehemalige Schule; Putzbau mit Dachreiter, Rundbogenöffnungen, 1838, Architekt wohl Johann Schmeisser, Kusel",49.574958,7.441832
Denkmalzone ehemalige Arbeiterkolonie Schneeweiderhof (westlich des Ortes am Hermannsberg),Eßweiler,"Wohngebäude für die Steinbrucharbeiter, zwei- und dreigeschossige Heimatstilbauten aus Basaltbruchstein, rückwärtig Hof und Ziegenställe, 1922–24, Architekten Heinrich Mattar und Eduard Scheler, Köln",49.558406,7.564497
Läppchen 1,Eßweiler,"Protestantische Kirche; barocker Saalbau, 1733, Turm mit Zeltdach, 1865, Architekt Johann Schmeisser, Kusel; Orgel von E.F. Walcker & Cie. Ludwigsburg aus dem Jahr 1869; steinerner Laufbrunnen, 1857",49.558985,7.564444
(bei) Läppchen 1,Eßweiler,"Kriegerdenkmal 1914/18 und 1939/45, Brunnenanlage, 1927, von Karl Dick, Kaiserslautern, nach 1945 erweitert",49.558985,7.564444
Mühlgasse 5,Eßweiler,"ehemalige Getreidemühle; eingeschossiger sandsteingegliederter Putzbau über oberirdischem Keller, 1870; technische Ausstattung der 1920/30er Jahre, Turbine 1950er Jahre",49.557845,7.565108
"





Läppchen 1",Eßweiler,"Protestantische Kirche


",49.558985,7.564444
"





Läppchen 1",Eßweiler,"steinerner Laufbrunnen


",49.558985,7.564444
(an) Brunnenstraße 3,Föckelberg,"Ofenstein, bezeichnet 1771, Ofenplatte, bezeichnet 1720",49.523437,7.491303
(an) Eckstraße 9,Föckelberg,"Ofenplatte, bezeichnet 1720, Ofenstein",49.528729,7.491186
(an) Hofgartenstraße 1,Föckelberg,"Ofenstein, bezeichnet 1802",49.522759,7.493108
Hauptstraße 35,Ginsweiler,"eingeschossiges Quereinhaus mit Drempel, bezeichnet 1830",49.653844,7.648193
(an) Naumburger Hof 3a,Ginsweiler,"Spolie, Quader eines römischen Grabmals","",""
Brücke über den Glan,Glanbrücken,"dreibogige Sandsteinquaderbrücke mit Flutbrechern, 1751/52, Architekt Bauschaffner Euler, Zweibrücken, hohe Flügelmauer 1789",49.613206,7.529733
"An den Mühlen 10, 11",Glanbrücken,"ehemalige Kellbachsche Mühle; 1358 erstmals erwähnt, 1823 geteilt; Nr. 10 ehemalige Ölmühle, um Wohntrakt erweitert, rechtwinklig Ökonomietrakt, hölzernes Wasserrad; Nr. 11 zweieinhalbgeschossiges Mühlengebäude, 1863, technische Ausstattung aus den 1920er und 1950er Jahren; Stallscheune mit dreischiffigem Stall, 1869; ortsbildprägend",49.611268,7.528726
(an) Friedhofstraße 4,Glanbrücken,"Doppelwappen der Freiherren von Kellenbach, bezeichnet 1629; vom alten Hofhaus zwei ehemalige Konsolsteine",49.614298,7.526966
Glanstraße 42,Glanbrücken,"Evangelische Kirche; mittelalterlicher Saalbau mit Chorturm, 1336, bezeichnet 1521 (eventuell Umbau), Westgiebel 1754 erneuert; auf dem Friedhof Kriegerdenkmal 1914/18",49.543818,7.440719
Glantalstraße 7/9,Glanbrücken,"ehemaliger Bahnhof; Quaderbau, eingeschossiges Lagerhaus mit Rampe, separates Abortgebäude, 1904; ortsbildprägend",49.614619,7.531511
Kirrweilerstraße 14,Glanbrücken,"Quereinhaus 1782, Erweiterung 1786, Stallscheune 1857",49.613679,7.527864
Beethovenstraße 4,Glan-Münchweiler,"Protestantischer Pfarrhof; Quereinhaus mit Krüppelwalmdach, bezeichnet 1737, Ökonomie 1777",49.472657,7.4438
Hauptstraße 2,Glan-Münchweiler,"Mühle am Glan; stattlicher Krüppelwalmdachbau, 1812, Architekt Peter Bell, Kusel; Zwischentrakt mit Wasserrädern, Teil des alten Mühlengebäudes, 1938, später aufgestockt und erweitert",49.47158,7.44433
(an) Hauptstraße 13,Glan-Münchweiler,"Torbogen, Sandstein, bezeichnet 1754",49.47206,7.443135
Hauptstraße 16,Glan-Münchweiler,"Protestantische Pfarrkirche; mittelalterlicher Rechteckchor, Chorflankenturm, Sakristeianbau im 15. Jahrhundert, barocker Saal, 1771 unter Beibehaltung der Umfassungsmauern, Architekt Philipp Heinrich Hellermann, Zweibrücken; Stumm-Orgel von 1865; römische Spolien und Sarkophage",49.47247,7.443153
Hauptstraße 21,Glan-Münchweiler,"sogenannte Alte Apotheke; Wohnhaus, sandsteingegliederter Putzbau, 1862",49.472194,7.442659
Ringstraße 29,Glan-Münchweiler,"Katholische Pfarrkirche St. Pirminus; zweischiffiger neuromanischer Sandsteinquaderbau, Glockenturm, 1900–02, Architekt Wilhelm Schulte I.",49.471346,7.440377
Ringstraße 41,Glan-Münchweiler,"ehemaliges Forstamtsgebäude; villenartiger Walmdachbau, eingeschossiger Seitenflügel und Treppenturm, bezeichnet 1914, Architekt Bruno Seyfarth, Kaiserslautern; ortsbildprägend",49.472797,7.438293
Schulstraße 1,Glan-Münchweiler,"ehemalige Schule; Kubus mit Lehrsaaltrakt und eingeschossigem Eingangs- und Abortgebäude, Pultdächer, Bauhausstil, 1932, Architekt Bruno Seyfarth, Kaiserslautern; ortsbildprägend",49.468817,7.442524
Bettenhausen 31,Glan-Münchweiler,"Hofanlage Rüb; Winkelanlage, im Kern aus dem 18. Jahrhundert, Erweiterung als Dreiseithof im 19. Jahrhundert; Wohnhaus mit hölzerner Galerie und Krüppelwalmdach, bezeichnet 1751, zwei Ökonomien, 1882/86, Remise, Gesindehaus; ortsbildprägend",49.463184,7.451822
Bettenhausen 33,Glan-Münchweiler,"stattliches Quereinhaus, 1835; zusammen mit Hofanlage Rüb ortsbildprägend",49.463184,7.451822
"Denkmalzone Ortskern (Auf dem Schloß, Friedhofweg, In der Hohl, Oberstraße, Sonnhofweg, Unterstraße, Weiherdamm)",Grumbach (Glan),"aus den beiden Siedlungskernen Grumbach-Tal und Grumbach-Schloß zusammengewachsener historischer Ortskern; weitgehend geschlossene Bebauung entlang der hangparallelen Straßen an dem steil aufsteigenden Schlossberg über Substruktionen, Bausubstanz des 18. und 19. Jahrhunderts, kennzeichnendes Ortsbild",50.425789,11.498597
"Denkmalzone Schloßberg (Auf dem Schloß, Oberstraße)",Grumbach (Glan),"von der im 13. Jahrhundert errichteten wildgräflichen Burg nur noch das sogenannte Archivgebäude und Substruktionsmauern erhalten, vom rheingräflichen Schloss Teile der ehemaligen Zehntscheune (Oberstraße 33), eine weitere Scheune (Oberstraße 34 und 35) und Obergeschoss des Archivs (Auf dem Schloß 15) erhalten, im Westen Lustgarten, auf seiner Nordseite fünfachsiger unvollendeter Schlossneubau (Sonnhofweg 4)",50.425789,11.498597
"Auf dem Schloß 3, 5",Grumbach (Glan),"ehemaliges preußisches Amtsgericht; ursprünglich freistehender Quaderbau (heute verputzt), vor 1834, anschließend dreiachsiger übergiebelter Quaderbau, 1879",49.6583,7.556305
Auf dem Schloß 8,Grumbach (Glan),"sogenanntes rheingräfliches Archivgebäude; dreigeschossiger Putzbau, im Kern aus dem 16. Jahrhundert, jüngeres Zwischengeschoss, offene Loggia und Mansarddach, bezeichnet 1722, Umbau 1879",49.657967,7.556071
Auf dem Schloß 9,Grumbach (Glan),"Evangelische Pfarrkirche; klassizistischer Saalbau mit Vorhalle und eingestelltem Turm, 1836–38, Architekt Kommunalbaumeister Leonhard, St. Wendel; Stumm-Orgel von 1863",49.65781,7.556547
Oberstraße 14,Grumbach (Glan),"ehemaliger Adelshof; großvolumiger spätbarocker Krüppelwalmdachbau, bezeichnet 1780, Stallscheune 1781",49.657495,7.557446
Oberstraße 31,Grumbach (Glan),"sogenanntes Hofratsgebäude; großvolumiger Krüppelwalmdachbau über hohen Substruktionen, 18. Jahrhundert, im Kern wohl älter; ortsbildprägend",49.657297,7.555784
"Oberstraße 33, 34, 35",Grumbach (Glan),"ehemaliger Wirtschaftshof; Scheunenkomplex, vor 1631, Umbau im 18. Jahrhundert; Nr. 33 drei- und eingeschossige Zehntscheune, dendrodatiert 1766; Nr. 34 und 35 in den Substruktionen wohl aus dem 17. Jahrhundert",49.657617,7.555712
(an) Sonnenhofweg 8,Grumbach (Glan),Wappen der Rheingrafen zu Grumbach; quadrierter Wappenstein mit aufgesetztem Mittelschild,48.731604,9.681755
Unter dem Schloß 1,Grumbach (Glan),"Krüppelwalmdachbau, teilweise Fachwerk, bezeichnet 1779, eingeschossiger Anbau mit Krüppelwalmdach, eventuell jünger; ortsbildprägend",49.657997,7.555757
Unter dem Schloß 3,Grumbach (Glan),"spätbarocker Mansarddachbau, teilweise Fachwerk, um 1792",49.658189,7.555703
Denkmalzone Ruine Michelsburg,Haschbach am Remigiusberg,"kleine Burganlage, um 1260 von Graf Heinrich II. von Veldenz errichtet, 1689 zerstört; Pallaswand, Schildmauer, Nord-Wehrmauer, Reste eines Rundturms; Denkmal für den Heiligen Remigius, bezeichnet 1853, zwei Halsgräben","",""
Hauptstraße 34,Haschbach am Remigiusberg,"ehemalige Schule; elfachsiger sandsteingegliederter Putzbau, 1928, Architekt Hermann Kohl, Kaiserslautern",49.525788,7.429544
Westliche Münchtalstraße ohne Nummer,Haschbach am Remigiusberg,"Quellkammer; Brunnenhaus aus Sandsteinplatten, 18. Jahrhundert",48.892251,8.684733
"in der Flur Tunnelplatz, auf halbem Weg zum Remigiusberg",Haschbach am Remigiusberg,"Kapelle; Quaderbau mit Zeltdach, 1881",49.193558,8.115308
Remigiusbergstraße,Haschbach am Remigiusberg,"ehemalige Propsteikirche; Vierungspfeiler, Teile der Langhausarkaden sowie nördlicher Chorflankenturm des Gründungsbaus, 12. Jahrhundert; Portal und Maßwerkfenster der Westfassade, zweite Hälfte des 13. Jahrhunderts; Chor um 1330; Kapelle wohl aus dem 15. Jahrhundert; Glockengeschoss mit welscher Haube, 18. Jahrhundert, Fassade im Wesentlichen von 1845; Pfarrhaus, 1842/43, Architekt Johann Schmeisser, Kusel",49.525022,7.43973
Oberdorf,Hausweiler,"Glockenturm, zweigeschossiger Satteldachbau, 1929, Schuppen",49.647784,7.564408
(bei) Talstraße 1,Hefersweiler,"Kriegerdenkmal 1914/18 und 1939/45; Adler auf Kubus, 1931, Entwurf Landbauamt Kaiserslautern, nach 1945 erweitert",49.60128,7.687459
(an) Talstraße 10,Hefersweiler,"Türgewände, bezeichnet 1574",49.602897,7.687764
Talstraße 13,Hefersweiler,"ehemalige Schule; Quaderbau, Schulhaus mit Mansardwalmdach, Wohnhaus mit Walmdach, 1902/03, Bezirksbaumeister Kleinhans",49.603189,7.687809
nördlich der Ortslage auf dem Friedhof,Hefersweiler,"Kriegerdenkmal 1914/18; reliefierte Stele, 1931, Entwurf Landbauamt Kaiserslautern, Bildhauerwerkstatt Nessler, Lauterecken",52.866262,14.057547
Bergstraße 1,Hefersweiler,"ehemalige Schule; zweigeschossiger Putzbau, Treppenhaus mit Welscher Haube, 1895",49.610136,7.687297
"





Hefersweiler, Talstraße 13",Hefersweiler,"ehemalige Schule


",49.603189,7.687809
"





Hefersweiler, (bei) Talstraße 1",Hefersweiler,"Kriegerdenkmal 1914/18 und 1939/45


",49.60128,7.687459
"





nördlich der Ortslage auf dem Friedhof",Hefersweiler,"Kriegerdenkmal 1914/18


",52.866262,14.057547
"





Berzweiler, Bergstraße 1",Hefersweiler,"ehemalige Schule


","",""
Hauptstraße 26,Henschtal,"ehemalige Schule; sandsteingegliederter Putzbau und Scheune, 1876, Architekt Johann Schmeisser, Kusel",49.465766,7.408442
Hauptstraße 27,Henschtal,"eingeschossiges Quereinhaus, 1855/56",49.465766,7.409619
Sangerhof 4,Henschtal,"sandsteingegliedertes Quereinhaus, 1876",49.473828,7.388149
(bei) Brückenstraße 1,Herchweiler,"Laufbrunnen, gusseiserne Säule, zweite Hälfte des 19. Jahrhunderts",49.513565,7.293152
In der Gass 14,Herchweiler,"eingeschossiges Quereinhaus mit seltener deutsch-hebräischer Türinschrift, 1858",49.514875,7.288427
Hauptstraße 21,Herren-Sulzbach,"Evangelische Pfarrkirche; Glockenturm, um 1075, Saalbau mit Krüppelwalmdach, wohl aus dem 16. Jahrhundert, Umbau 1714/15; Ausstattung, Stumm-Orgel von 1820/22",49.648408,7.527819
Hauptstraße 22,Herren-Sulzbach,"ehemalige Schule; fünfachsiger sandsteingegliederter Putzbau, 1849, Aufstockung um 1890; ortsbildprägend",49.648088,7.527262
Am Schäfergarten 12,Herschweiler-Pettersheim,"ehemalige Schule; großvolumiger, sandsteingegliederter Walmdachbau, 1909/10, Architekt C. M. Raysz, Kaiserslautern",49.476579,7.344967
Hauptstraße 1–9,Herschweiler-Pettersheim,"Hofgut Hauter; langgestreckte Hofanlage; Wohnhaus 1836, ehemalige Scheune und Stallungen, eingeschossiges Wirtschaftsgebäude bezeichnet 1841",49.469777,7.343763
Kirchenstraße 47,Herschweiler-Pettersheim,"Protestantische Pfarrkirche; asymmetrischer Bossenquaderbau, 1954, Architekt Eugen Heußer, Kaiserslautern; Saalbau mit Westriegel",49.477018,7.348363
nördlich des Ortes,Herschweiler-Pettersheim,"Villa rustica; Reste eines römerzeitlichen Gutshofes, frühes 2. Jahrhundert; kleines Herrenhaus mit Portikus und Eckrisaliten, Halle mit Keller",49.480407,7.347195
Denkmalzone Jüdischer Friedhof (bei Bergstraße 7),Hinzweiler,"von Hecke umfriedetes Areal, 1870 angelegt, 57 Grabsteine",49.592217,7.549055
Hauptstraße 44,Hinzweiler,"Protestantische Pfarrkirche; Saalbau, bezeichnet 1727, spätmittelalterlicher Chor, darüber Glockenturm um 1600; Pfarrergrabstein, 1741",47.546417,8.843788
Hauptstraße 47,Hinzweiler,"stattlicher Dreiseithof; Einfirstanlage, um 1830, fünfachsiges Wohnhaus 1868",47.546709,8.843635
Hauptstraße 48,Hinzweiler,"Protestantisches Pfarrhaus; Putzbau im Rundbogenstil, 1835/36, Architekt Ferdinand Beyschlag, Kaiserslautern",47.091494,7.449603
"Vordergasse 2, 4, 7",Hohenöllen,"ehemalige Schule; Nr. 4 eingeschossiger Putzbau mit Dachreiter, 1829; Nr. 2 Anbau mit Wohnung und Lehrsaal, 1849, Architekt Johann Schmeisser, Kusel; Nr. 7 eingeschossiger Walmdachbau mit Dachreiter, 1898, Architekt Bezirksbaumeister Kleinhans",49.62066,7.627909
südlich des Ortes,Hohenöllen,"Kriegerdenkmal für die Gefallenen beider Weltkriege; Sandsteinquaderstele, 1922 von Bildhauer Strauß, Lauterecken, 1952 erweitert",49.620257,7.627092
(bei) Hauptstraße 20,Homberg (bei Lauterecken),"ehemaliges Feuerspritzenhaus; eingeschossiger Quaderbau, offener Glockenstuhl, wohl aus der Mitte des 19. Jahrhunderts, Holztor aus den 1920er Jahren",49.655186,7.122949
Hauptstraße 29,Hoppstädten,"Evangelische Kirche; neugotischer Quaderbau, Fassadenturm, 1886/87",49.615757,7.195164
(bei) Hauptstraße 31,Hoppstädten,"ehemaliges Rathaus; kleiner, anspruchsvoller sandsteingegliederter Putzbau, um 1840",49.615757,7.195164
Alter Weg 7,Horschbach,"Protestantische Kirche; Saalbau mit Dachreiter, 1791; Ausstattung, Orgelprospekt 1792, Gebrüder Stumm; Glocke, 1792 von Jakob und Paul Klein, Ernstweiler",49.589029,7.529355
Alte Straße 26 und 28,Hüffler,"sandsteingegliederte Quereinhäuser, Nr. 26 1855/56, Nr. 28 bezeichnet 1838; ehemaliger Schweinestall",49.494048,7.389533
Kirchenstraße 8,Hüffler,"Protestantische Pfarrkirche; einschiffiger Quaderbau, 1875/76, Architekt Franz Schöberl, Speyer",49.494136,7.391158
(an) Hauptstraße 31,Jettenbach (Pfalz),"Sandsteinportal, bezeichnet 1829",48.168769,12.377114
(bei) Hauptstraße 46,Jettenbach (Pfalz),"Stundenstein, Sandsteinsäule, 19. Jahrhunderts",48.168769,12.377114
Hauptstraße 66,Jettenbach (Pfalz),"Musikantenhaus; eingeschossiger Putzbau über Sockelgeschoss, 1903/04, Architekt Karl Faul, Reichenbach",48.168769,12.377114
Höhstraße 2,Jettenbach (Pfalz),"Grundschule, sandsteingegliederter Putzbau, 1892/93; Luitpoldlinde von 1893",49.53664,7.553682
Honiggasse 1,Jettenbach (Pfalz),"Quereinhaus, teilweise Fachwerk, bezeichnet 1740 und 1776, eingeschossiger Krüppelwalmdachanbau, Werkstattgebäude um 1900; Ofenstein, bezeichnet 1793, Ofenplatte, bezeichnet 1720",49.536529,7.553206
Kirchstraße 2,Jettenbach (Pfalz),"Protestantische Pfarrkirche; zweischiffige neugotische Hallenkirche, 1895/96, Architekt Franz Schöberl, Speyer; Ausstattung",49.536517,7.556808
(an) Kirchstraße 5,Jettenbach (Pfalz),"Ofenstein, bezeichnet 1801",49.537025,7.55626
(an) Kirchstraße 8,Jettenbach (Pfalz),"Ofenstein, bezeichnet 1829",49.535728,7.557212
Denkmalzone Evangelische Kirche (Hauptstr. 22),Kappeln (bei Lauterecken),"Gesamtanlage aus evangelischer Kirche (romanischer Glockenturm, dendrodatiert auf die Mitte des 12. Jahrhunderts, 1862 erhöht; barocker Saalbau, 1789/90; Oberlinger-Orgel, 19. Jahrhundert) und Dreiseithof (Hauptstraße 20, mit mittelalterlichen Spolien in den Ökonomiegebäuden)",48.175265,13.326319
(bei) Damm 4,Kappeln (bei Lauterecken),"Brunnenhäuschen, kleiner Bruchsteinbau, wohl aus dem 19. Jahrhundert",49.674847,7.569851
Friedhofweg 2,Kappeln (bei Lauterecken),"ehemaliges Pfarrhaus; sandsteingegliederter Putzbau über hohem Quadersockel, 1854–56, Architekt Kreisbaurat Leonhard, St. Wendel; in der Scheune römische Spolie",49.676316,7.569995
(bei) Oberdorf 15,Kappeln (bei Lauterecken),"Brunnenhäuschen, kleiner halbrunder Bau, wohl aus dem 19. Jahrhundert",49.678479,7.569501
Oberdorf 15,Kappeln (bei Lauterecken),"Treppengiebelhaus, bezeichnet 1764, Umbau 1908",49.678479,7.569501
(an) Unterdorf 6,Kappeln (bei Lauterecken),"Rundbogenportal, bezeichnet 1589",49.677406,7.570813
Hauptstraße 16,Kirrweiler (bei Lauterecken),"Friedhofshalle, langgestreckte Walmdachhalle, bezeichnet 1836",49.637576,7.504068
Oberdorf 4,Kirrweiler (bei Lauterecken),"Quereinhaus, im Kern aus dem 17. Jahrhundert, Umbau in der zweiten Hälfte des 19. Jahrhunderts",49.635014,7.500699
"Friedhofstraße, auf dem Friedhof",Konken,"Kriegerdenkmal 1914/18, bezeichnet 1921, von Emil und Eugen Reis, Kusel",49.50995,7.352199
