Im Brochenbachtal 29, Sankt Katharinen (Landkreis Neuwied),"Brochenbachsmühle, Fachwerkhaus, teilweise massiv"
Hummelsberger Straße, Sankt Katharinen (Landkreis Neuwied),"Katholische Filialkirche St. Apollonia; kleiner neugotischer Saalbau, nach 1878"
Bahnhofstraße, Sankt Katharinen (Landkreis Neuwied),"Wegekapelle, kreuzgratgewölbter Putzbau, um 1900"
Barbarastraße, Sankt Katharinen (Landkreis Neuwied),"Bildstock, bezeichnet 1691"
Linzer Straße 65, Sankt Katharinen (Landkreis Neuwied),"Katholische Pfarrkirche St. Katharina; ehemalige Klosterkirche, steiler sechsachsiger Putzbau, 1317–24, Seitenschiff 1912/13, Westportal 1901"
Hochstraße, Sankt Katharinen (Landkreis Neuwied),"Katholische Filialkirche Herz Jesu; kleiner neugotischer Saalbau, 1877/78"
Hochstraße, Sankt Katharinen (Landkreis Neuwied),"Wegekreuz, Schaftkreuz, bezeichnet 1719"
Hochstraße 5, Sankt Katharinen (Landkreis Neuwied),"stattliches Fachwerk-Quereinhaus, bezeichnet 1701; Fachwerkscheune, 18. oder 19. Jahrhundert"
